"Name","Source","Page","Level","Casting Time","Duration","School","Range","Components","Classes","Optional/Variant Classes","Text","At Higher Levels"
"Distort Value","AI","75","1st","1 Min.","8 hours","Illusion","Touch","V","Bard, Bard, Sorcerer, Sorcerer, Warlock, Warlock, Wizard, Wizard","","Do you need to squeeze a few more gold pieces out of a merchant as you try to sell that weird octopus statue you liberated from the chaos temple? Do you need to downplay the worth of some magical assets when the tax collector stops by? Distort value has you covered.You cast this spell on an object no more than 1 foot on a side, doubling the object's perceived value by adding illusory flourishes or polish to it, or reducing its perceived value by half with the help of illusory scratches, dents, and other unsightly features. Anyone examining the object can ascertain its true value with a successful Intelligence (Investigation) check against your spell save DC."," At Higher Levels. When you cast this spell using a spell slot of 2nd level or higher, the maximum size of the object increases by 1 foot for each slot level above 1st."
"Dominate Monster","PHB'24","265","8th","Action","Concentration, up to 1 hour","Enchantment","60 feet","V, S","Bard, Sorcerer, Warlock, Wizard","","One creature you can see within range must succeed on a Wisdom saving throw or have the Charmed condition for the duration. The target has Advantage on the save if you or your allies are fighting it. Whenever the target takes damage, it repeats the save, ending the spell on itself on a success.You have a telepathic link with the Charmed target while the two of you are on the same plane of existence. On your turn, you can use this link to issue commands to the target (no action required), such as ""Attack that creature,"" ""Move over there,"" or ""Fetch that object."" The target does its best to obey on its turn. If it completes an order and doesn't receive further direction from you, it acts and moves as it likes, focusing on protecting itself.You can command the target to take a Reaction but must take your own Reaction to do so."," Using a Higher-Level Spell Slot. Your Concentration can last longer with a level 9 spell slot (up to 8 hours)."
"Dominate Person","PHB'24","266","5th","Action","Concentration, up to 1 minute","Enchantment","60 feet","V, S","Bard, Sorcerer, Wizard","","One Humanoid you can see within range must succeed on a Wisdom saving throw or have the Charmed condition for the duration. The target has Advantage on the save if you or your allies are fighting it. Whenever the target takes damage, it repeats the save, ending the spell on itself on a success.You have a telepathic link with the Charmed target while the two of you are on the same plane of existence. On your turn, you can use this link to issue commands to the target (no action required), such as ""Attack that creature,"" ""Move over there,"" or ""Fetch that object."" The target does its best to obey on its turn. If it completes an order and doesn't receive further direction from you, it acts and moves as it likes, focusing on protecting itself.You can command the target to take a Reaction but must take your own Reaction to do so."," Using a Higher-Level Spell Slot. Your Concentration can last longer with a spell slot of level 6 (up to 10 minutes), 7 (up to 1 hour), or 8+ (up to 8 hours)."
"Dream","PHB'24","266","5th","1 Min.","8 hours","Illusion","Self","V, S, M (a handful of sand)","Bard, Warlock, Wizard","","You target a creature you know on the same plane of existence. You or a willing creature you touch enters a trance state to act as a dream messenger. While in the trance, the messenger is Incapacitated and has a Speed of 0.If the target is asleep, the messenger appears in the target's dreams and can converse with the target as long as it remains asleep, through the spell's duration. The messenger can also shape the dream's environment, creating landscapes, objects, and other images. The messenger can emerge from the trance at any time, ending the spell. The target recalls the dream perfectly upon waking.If the target is awake when you cast the spell, the messenger knows it and can either end the trance (and the spell) or wait for the target to sleep, at which point the messenger enters its dreams.You can make the messenger terrifying to the target. If you do so, the messenger can deliver a message of no more than ten words, and then the target makes a Wisdom saving throw. On a failed save, the target gains no benefit from its rest, and it takes 3d6 Psychic damage when it wakes up.",""
"Dream of the Blue Veil","TCE","106","7th","10 Min.","6 hours","Conjuration","20 feet","V, S, M (a magic item or a willing creature from the destination world)","","Bard, Bard, Sorcerer, Sorcerer, Warlock, Warlock, Wizard, Wizard","You and up to eight willing creatures within range fall unconscious for the spell's duration and experience visions of another world on the Material Plane, such as Oerth, Toril, Krynn, or Eberron. If the spell reaches its full duration, the visions conclude with each of you encountering and pulling back a mysterious blue curtain. The spell then ends with you mentally and physically transported to the world that was in the visions.To cast this spell, you must have a magic item that originated on the world you wish to reach, and you must be aware of the world's existence, even if you don't know the world's name. Your destination in the other world is a safe location within 1 mile of where the magic item was created. Alternatively, you can cast the spell if one of the affected creatures was born on the other world, which causes your destination to be a safe location within 1 mile of where that creature was born.The spell ends early on a creature if that creature takes any damage, and the creature isn't transported. If you take any damage, the spell ends for you and all the other creatures, with none of you being transported.",""
"Earth Tremor","XGE","155","1st","Action","Instantaneous","Evocation","10 feet","V, S","Bard, Bard, Druid, Druid, Sorcerer, Sorcerer, Wizard, Wizard","","You cause a tremor in the ground within range. Each creature other than you in that area must make a Dexterity saving throw. On a failed save, a creature takes 1d6 bludgeoning damage and is knocked prone. If the ground in that area is loose earth or stone, it becomes difficult terrain until cleared, with each 5-foot-diameter portion requiring at least 1 minute to clear by hand."," At Higher Levels. When you cast this spell using a spell slot of 2nd level or higher, the damage increases by 1d6 for each slot level above 1st."
"Enemies Abound","XGE","155","3rd","Action","Concentration, up to 1 minute","Enchantment","120 feet","V, S","Bard, Bard, Sorcerer, Sorcerer, Warlock, Warlock, Wizard, Wizard","","You reach into the mind of one creature you can see and force it to make an Intelligence saving throw. A creature automatically succeeds if it is immune to being frightened. On a failed save, the target loses the ability to distinguish friend from foe, regarding all creatures it can see as enemies until the spell ends. Each time the target takes damage, it can repeat the saving throw, ending the effect on itself on a success.Whenever the affected creature chooses another creature as a target, it must choose the target at random from among the creatures it can see within range of the attack, spell, or other ability it's using. If an enemy provokes an opportunity attack from the affected creature, the creature must make that attack if it is able to.",""
"Enhance Ability","PHB'24","268","2nd","Action","Concentration, up to 1 hour","Transmutation","Touch","V, S, M (fur or a feather)","Artificer, Bard, Cleric, Druid, Ranger, Sorcerer, Wizard","","You touch a creature and choose Strength, Dexterity, Intelligence, Wisdom, or Charisma. For the duration, the target has Advantage on ability checks using the chosen ability."," Using a Higher-Level Spell Slot. You can target one additional creature for each spell slot level above 2. You can choose a different ability for each target."
"Enlarge/Reduce","PHB'24","268","2nd","Action","Concentration, up to 1 minute","Transmutation","30 feet","V, S, M (a pinch of powdered iron)","Artificer, Bard, Druid, Sorcerer, Wizard","","For the duration, the spell enlarges or reduces a creature or an object you can see within range (see the chosen effect below). A targeted object must be neither worn nor carried. If the target is an unwilling creature, it can make a Constitution saving throw. On a successful save, the spell has no effect.Everything that a targeted creature is wearing and carrying changes size with it. Any item it drops returns to normal size at once. A thrown weapon or piece of ammunition returns to normal size immediately after it hits or misses a target. Enlarge. The target's size increases by one category—from Medium to Large, for example. The target also has Advantage on Strength checks and Strength saving throws. The target's attacks with its enlarged weapons or Unarmed Strikes deal an extra 1d4 damage on a hit. Reduce. The target's size decreases by one category—from Medium to Small, for example. The target also has Disadvantage on Strength checks and Strength saving throws. The target's attacks with its reduced weapons or Unarmed Strikes deal 1d4 less damage on a hit (this can't reduce the damage below 1).",""
"Enthrall","PHB'24","269","2nd","Action","1 minute","Enchantment","60 feet","V, S","Bard, Warlock","","You weave a distracting string of words, causing creatures of your choice that you can see within range to make a Wisdom saving throw. Any creature you or your companions are fighting automatically succeeds on this save. On a failed save, a target has a -10 penalty to Wisdom (Perception) checks and Passive Perception until the spell ends.",""
"Etherealness","PHB'24","269","7th","Action","8 hours","Conjuration","Self","V, S","Bard, Cleric, Sorcerer, Warlock, Wizard","","You step into the border regions of the Ethereal Plane, where it overlaps with your current plane. You remain in the Border Ethereal for the duration. During this time, you can move in any direction. If you move up or down, every foot of movement costs an extra foot. You can perceive the plane you left, which looks gray, and you can't see anything there more than 60 feet away.While on the Ethereal Plane, you can affect and be affected only by creatures, objects, and effects on that plane. Creatures that aren't on the Ethereal Plane can't perceive or interact with you unless a feature gives them the ability to do so.When the spell ends, you return to the plane you left in the spot that corresponds to your space in the Border Ethereal. If you appear in an occupied space, you are shunted to the nearest unoccupied space and take Force damage equal to twice the number of feet you are moved.This spell ends instantly if you cast it while you are on the Ethereal Plane or a plane that doesn't border it, such as one of the Outer Planes."," Using a Higher-Level Spell Slot. You can target up to three willing creatures (including yourself) for each spell slot level above 7. The creatures must be within 10 feet of you when you cast the spell."
"Eyebite","PHB'24","270","6th","Action","Concentration, up to 1 minute","Necromancy","Self","V, S","Bard, Sorcerer, Warlock, Wizard","","For the duration, your eyes become an inky void. One creature of your choice within 60 feet of you that you can see must succeed on a Wisdom saving throw or be affected by one of the following effects of your choice for the duration.On each of your turns until the spell ends, you can take a Magic action to target another creature but can't target a creature again if it has succeeded on a save against this casting of the spell. Asleep. The target has the Unconscious condition. It wakes up if it takes any damage or if another creature takes an action to shake it awake. Panicked. The target has the Frightened condition. On each of its turns, the Frightened target must take the Dash action and move away from you by the safest and shortest route available. If the target moves to a space at least 60 feet away from you where it can't see you, this effect ends. Sickened. The target has the Poisoned condition.",""
"Faerie Fire","PHB'24","271","1st","Action","Concentration, up to 1 minute","Evocation","60 feet","V","Artificer, Bard, Druid","","Objects in a 20-foot Cube within range are outlined in blue, green, or violet light (your choice). Each creature in the Cube is also outlined if it fails a Dexterity saving throw. For the duration, objects and affected creatures shed Dim Light in a 10-foot radius and can't benefit from the Invisible condition.Attack rolls against an affected creature or object have Advantage if the attacker can see it.",""
"Fast Friends","AI","75","3rd","Action","Concentration, up to 1 hour","Enchantment","30 feet","V","Bard, Bard, Cleric, Cleric, Wizard, Wizard","","When you need to make sure something gets done, you can't rely on vague promises, sworn oaths, or binding contracts of employment. When you cast this spell, choose one humanoid within range that can see and hear you, and that can understand you. The creature must succeed on a Wisdom saving throw or become charmed by you for the duration. While the creature is charmed in this way, it undertakes to perform any services or activities you ask of it in a friendly manner, to the best of its ability.You can set the creature new tasks when a previous task is completed, or if you decide to end its current task. If the service or activity might cause harm to the creature, or if it conflicts with the creature's normal activities and desires, the creature can make another Wisdom saving throw to try to end the effect. This save is made with advantage if you or your companions are fighting the creature. If the activity would result in certain death for the creature, the spell ends.When the spell ends, the creature knows it was charmed by you."," At Higher Levels. When you cast this spell using a spell slot of 4th level or higher, you can target one additional creature for each slot level above 3rd."
"Fear","PHB'24","271","3rd","Action","Concentration, up to 1 minute","Illusion","Self","V, S, M (a white feather)","Bard, Sorcerer, Warlock, Wizard","","Each creature in a 30-foot Cone must succeed on a Wisdom saving throw or drop whatever it is holding and have the Frightened condition for the duration.A Frightened creature takes the Dash action and moves away from you by the safest route on each of its turns unless there is nowhere to move. If the creature ends its turn in a space where it doesn't have line of sight to you, the creature makes a Wisdom saving throw. On a successful save, the spell ends on that creature.",""
"Feather Fall","PHB'24","271","1st","Reaction","1 minute","Transmutation","60 feet","V, M (a small feather or piece of down)","Artificer, Bard, Sorcerer, Wizard","","Choose up to five falling creatures within range. A falling creature's rate of descent slows to 60 feet per round until the spell ends. If a creature lands before the spell ends, the creature takes no damage from the fall, and the spell ends for that creature.",""
"Feign Death","PHB'24","271","3rd","Action","1 hour","Necromancy (ritual)","Touch","V, S, M (a pinch of graveyard dirt)","Bard, Cleric, Druid, Wizard","","You touch a willing creature and put it into a cataleptic state that is indistinguishable from death.For the duration, the target appears dead to outward inspection and to spells used to determine the target's status. The target has the Blinded and Incapacitated conditions, and its Speed is 0.The target also has Resistance to all damage except Psychic damage, and it has Immunity to the Poisoned condition.",""
"Find the Path","PHB'24","273","6th","1 Min.","Concentration, up to 1 day","Divination","Self","V, S, M (a set of divination tools—such as cards or runes—worth 100+ GP)","Bard, Cleric, Druid","","You magically sense the most direct physical route to a location you name. You must be familiar with the location, and the spell fails if you name a destination on another plane of existence, a moving destination (such as a mobile fortress), or an unspecific destination (such as ""a green dragon's lair"").For the duration, as long as you are on the same plane of existence as the destination, you know how far it is and in what direction it lies. Whenever you face a choice of paths along the way there, you know which path is the most direct.",""
"Forcecage","PHB'24","276","7th","Action","Concentration, up to 1 hour","Evocation","100 feet","V, S, M (ruby dust worth 1,500+ GP, which the spell consumes)","Bard, Warlock, Wizard","","An immobile, Invisible, Cube-shaped prison composed of magical force springs into existence around an area you choose within range. The prison can be a cage or a solid box, as you choose.A prison in the shape of a cage can be up to 20 feet on a side and is made from 1/2-inch diameter bars spaced 1/2 inch apart. A prison in the shape of a box can be up to 10 feet on a side, creating a solid barrier that prevents any matter from passing through it and blocking any spells cast into or out from the area.When you cast the spell, any creature that is completely inside the cage's area is trapped. Creatures only partially within the area, or those too large to fit inside it, are pushed away from the center of the area until they are completely outside it.A creature inside the cage can't leave it by nonmagical means. If the creature tries to use teleportation or interplanar travel to leave, it must first make a Charisma saving throw. On a successful save, the creature can use that magic to exit the cage. On a failed save, the creature doesn't exit the cage and wastes the spell or effect. The cage also extends into the Ethereal Plane, blocking ethereal travel.This spell can't be dispelled by Dispel Magic.",""
"Foresight","PHB'24","276","9th","1 Min.","8 hours","Divination","Touch","V, S, M (a hummingbird feather)","Bard, Druid, Warlock, Wizard","","You touch a willing creature and bestow a limited ability to see into the immediate future. For the duration, the target has Advantage on D20 Tests, and other creatures have Disadvantage on attack rolls against it. The spell ends early if you cast it again.",""
"Fount of Moonlight","PHB'24","277","4th","Action","Concentration, up to 10 minutes","Evocation","Self","V, S","Bard, Druid","","A cool light wreathes your body for the duration, emitting Bright Light in a 20-foot radius and Dim Light for an additional 20 feet.Until the spell ends, you have Resistance to Radiant damage, and your melee attacks deal an extra 2d6 Radiant damage on a hit.In addition, immediately after you take damage from a creature you can see within 60 feet of yourself, you can take a Reaction to force the creature to make a Constitution saving throw. On a failed save, the creature has the Blinded condition until the end of your next turn.",""
"Freedom of Movement","PHB'24","277","4th","Action","1 hour","Abjuration","Touch","V, S, M (a leather strap)","Artificer, Bard, Cleric, Druid, Ranger","","You touch a willing creature. For the duration, the target's movement is unaffected by Difficult Terrain, and spells and other magical effects can neither reduce the target's Speed nor cause the target to have the Paralyzed or Restrained conditions. The target also has a Swim Speed equal to its Speed.In addition, the target can spend 5 feet of movement to automatically escape from nonmagical restraints, such as manacles or a creature imposing the Grappled condition on it."," Using a Higher-Level Spell Slot. You can target one additional creature for each spell slot level above 4."
"Friends","PHB'24","277","Cantrip","Action","Concentration, up to 1 minute","Enchantment","10 feet","S, M (some makeup)","Bard, Sorcerer, Warlock, Wizard","","You magically emanate a sense of friendship toward one creature you can see within range. The target must succeed on a Wisdom saving throw or have the Charmed condition for the duration. The target succeeds automatically if it isn't a Humanoid, if you're fighting it, or if you have cast this spell on it within the past 24 hours.The spell ends early if the target takes damage or if you make an attack roll, deal damage, or force anyone to make a saving throw. When the spell ends, the target knows it was Charmed by you.",""
"Geas","PHB'24","278","5th","1 Min.","30 days","Enchantment","60 feet","V","Bard, Cleric, Druid, Paladin, Wizard","","You give a verbal command to a creature that you can see within range, ordering it to carry out some service or refrain from an action or a course of activity as you decide. The target must succeed on a Wisdom saving throw or have the Charmed condition for the duration. The target automatically succeeds if it can't understand your command.While Charmed, the creature takes 5d10 Psychic damage if it acts in a manner directly counter to your command. It takes this damage no more than once each day.You can issue any command you choose, short of an activity that would result in certain death. Should you issue a suicidal command, the spell ends.A Remove Curse, Greater Restoration, or Wish spell ends this spell."," Using a Higher-Level Spell Slot. If you use a level 7 or 8 spell slot, the duration is 365 days. If you use a level 9 spell slot, the spell lasts until it is ended by one of the spells mentioned above."
"Gift of Gab","AI","76","2nd","Reaction","Instantaneous","Enchantment","Self","V, S, R (2 gp)","Bard, Bard, Wizard, Wizard","","“When I met Jim Darkmagic, I wondered how he got anything done in that outfit. I have since learned that most of his talents involve standing and talking. His outfit is perfect for that.”— MôrgænJim Darkmagic is said to have invented this spell, originally calling it I said what?! Have you ever been talking to the local monarch and accidentally mentioned how their son looks like your favorite hog from when you were growing up on the family farm? We've all been there! But rather than being beheaded for an honest slip of the tongue, you can pretend it never happened—by ensuring that no one knows it happened.When you cast this spell, you skillfully reshape the memories of listeners in your immediate area, so that each creature of your choice within 5 feet of you forgets everything you said within the last 6 seconds. Those creatures then remember that you actually said the words you speak as the verbal component of the spell.",""
"Glibness","PHB'24","279","8th","Action","1 hour","Transmutation","Self","V","Bard, Warlock","","Until the spell ends, when you make a Charisma check, you can replace the number you roll with a 15. Additionally, no matter what you say, magic that would determine if you are telling the truth indicates that you are being truthful.",""
"Glyph of Warding","PHB'24","279","3rd","1 Hr.","Until dispelled or triggered","Abjuration","Touch","V, S, M (powdered diamond worth 200+ GP, which the spell consumes)","Artificer, Bard, Cleric, Wizard","","You inscribe a glyph that later unleashes a magical effect. You inscribe it either on a surface (such as a table or a section of floor) or within an object that can be closed (such as a book or chest) to conceal the glyph. The glyph can cover an area no larger than 10 feet in diameter. If the surface or object is moved more than 10 feet from where you cast this spell, the glyph is broken, and the spell ends without being triggered.The glyph is nearly imperceptible and requires a successful Wisdom (Perception) check against your spell save DC to notice.When you inscribe the glyph, you set its trigger and choose whether it's an explosive rune or a spell glyph, as explained below. Set the Trigger. You decide what triggers the glyph when you cast the spell. For glyphs inscribed on a surface, common triggers include touching or stepping on the glyph, removing another object covering it, or approaching within a certain distance of it. For glyphs inscribed within an object, common triggers include opening that object or seeing the glyph. Once a glyph is triggered, this spell ends.You can refine the trigger so that only creatures of certain types activate it (for example, the glyph could be set to affect Aberrations). You can also set conditions for creatures that don't trigger the glyph, such as those who say a certain password. Explosive Rune. When triggered, the glyph erupts with magical energy in a 20-foot-radius Sphere centered on the glyph. Each creature in the area makes a Dexterity saving throw. A creature takes 5d8 Acid, Cold, Fire, Lightning, or Thunder damage (your choice when you create the glyph) on a failed save or half as much damage on a successful one. Spell Glyph. You can store a prepared spell of level 3 or lower in the glyph by casting it as part of creating the glyph. The spell must target a single creature or an area. The spell being stored has no immediate effect when cast in this way.When the glyph is triggered, the stored spell takes effect. If the spell has a target, it targets the creature that triggered the glyph. If the spell affects an area, the area is centered on that creature. If the spell summons Hostile creatures or creates harmful objects or traps, they appear as close as possible to the intruder and attack it. If the spell requires Concentration, it lasts until the end of its full duration."," Using a Higher-Level Spell Slot. The damage of an explosive rune increases by 1d8 for each spell slot level above 3. If you create a spell glyph, you can store any spell of up to the same level as the spell slot you use for the Glyph of Warding."
