"Name","Source","Page","Level","Casting Time","Duration","School","Range","Components","Classes","Optional/Variant Classes","Text","At Higher Levels"
"Programmed Illusion","PHB'24","309","6th","Action","Until dispelled","Illusion","120 feet","V, S, M (jade dust worth 25+ GP)","Bard, Wizard","","You create an illusion of an object, a creature, or some other visible phenomenon within range that activates when a specific trigger occurs. The illusion is imperceptible until then. It must be no larger than a 30-foot Cube, and you decide when you cast the spell how the illusion behaves and what sounds it makes. This scripted performance can last up to 5 minutes.When the trigger you specify occurs, the illusion springs into existence and performs in the manner you described. Once the illusion finishes performing, it disappears and remains dormant for 10 minutes, after which the illusion can be activated again.The trigger can be as general or as detailed as you like, though it must be based on visual or audible phenomena that occur within 30 feet of the area. For example, you could create an illusion of yourself to appear and warn off others who attempt to open a trapped door.Physical interaction with the image reveals it to be illusory, since things can pass through it. A creature that takes the Study action to examine the image can determine that it is an illusion with a successful Intelligence (Investigation) check against your spell save DC. If a creature discerns the illusion for what it is, the creature can see through the image, and any noise it makes sounds hollow to the creature.",""
"Project Image","PHB'24","309","7th","Action","Concentration, up to 1 day","Illusion","500 miles","V, S, M (a statuette of yourself worth 5+ GP)","Bard, Wizard","","You create an illusory copy of yourself that lasts for the duration. The copy can appear at any location within range that you have seen before, regardless of intervening obstacles. The illusion looks and sounds like you, but it is intangible. If the illusion takes any damage, it disappears, and the spell ends.You can see through the illusion's eyes and hear through its ears as if you were in its space. As a Magic action, you can move it up to 60 feet and make it gesture, speak, and behave in whatever way you choose. It mimics your mannerisms perfectly.Physical interaction with the image reveals it to be illusory, since things can pass through it. A creature that takes the Study action to examine the image can determine that it is an illusion with a successful Intelligence (Investigation) check against your spell save DC. If a creature discerns the illusion for what it is, the creature can see through the image, and any noise it makes sounds hollow to the creature.",""
"Psychic Scream","XGE","163","9th","Action","Instantaneous","Enchantment","90 feet","S","Bard, Bard, Sorcerer, Sorcerer, Warlock, Warlock, Wizard, Wizard","","You unleash the power of your mind to blast the intellect of up to ten creatures of your choice that you can see within range. Creatures that have an Intelligence score of 2 or lower are unaffected.Each target must make an Intelligence saving throw. On a failed save, a target takes 14d6 psychic damage and is stunned. On a successful save, a target takes half as much damage and isn't stunned. If a target is killed by this damage, its head explodes, assuming it has one.A stunned target can make an Intelligence saving throw at the end of each of its turns. On a successful save, the stunning effect ends.",""
"Pyrotechnics","XGE","163","2nd","Action","Instantaneous","Transmutation","60 feet","V, S","Artificer, Bard, Bard, Sorcerer, Sorcerer, Wizard, Wizard","","Choose an area of nonmagical flame that you can see and that fits within a 5-foot cube within range. You can extinguish the fire in that area, and you create either fireworks or smoke when you do so. Fireworks. The target explodes with a dazzling display of colors. Each creature within 10 feet of the target must succeed on a Constitution saving throw or become blinded until the end of your next turn. Smoke. Thick black smoke spreads out from the target in a 20-foot radius, moving around corners. The area of the smoke is heavily obscured. The smoke persists for 1 minute or until a strong wind disperses it.",""
"Raise Dead","PHB'24","310","5th","1 Hr.","Instantaneous","Necromancy","Touch","V, S, M (a diamond worth 500+ GP, which the spell consumes)","Bard, Cleric, Paladin","","With a touch, you revive a dead creature if it has been dead no longer than 10 days and it wasn't Undead when it died.The creature returns to life with 1 Hit Point. This spell also neutralizes any poisons that affected the creature at the time of death.This spell closes all mortal wounds, but it doesn't restore missing body parts. If the creature is lacking body parts or organs integral for its survival—its head, for instance—the spell automatically fails.Coming back from the dead is an ordeal. The target takes a -4 penalty to D20 Tests. Every time the target finishes a Long Rest, the penalty is reduced by 1 until it becomes 0.",""
"Rary's Telepathic Bond","PHB'24","311","5th","Action","1 hour","Divination (ritual)","30 feet","V, S, M (two eggs)","Bard, Wizard","","You forge a telepathic link among up to eight willing creatures of your choice within range, psychically linking each creature to all the others for the duration. Creatures that can't communicate in any languages aren't affected by this spell.Until the spell ends, the targets can communicate telepathically through the bond whether or not they share a language. The communication is possible over any distance, though it can't extend to other planes of existence.",""
"Raulothim's Psychic Lance","FTD","21","4th","Action","Instantaneous","Enchantment","120 feet","V","Bard, Bard, Sorcerer, Sorcerer, Warlock, Warlock, Wizard, Wizard","","You unleash a shimmering lance of psychic power from your forehead at a creature that you can see within range. Alternatively, you can utter a creature's name. If the named target is within range, it becomes the spell's target even if you can't see it. If the named target isn't within range, the lance dissipates without effect.The target must make an Intelligence saving throw. On a failed save, the target takes 7d6 psychic damage and is incapacitated until the start of your next turn. On a successful save, the creature takes half as much damage and isn't incapacitated."," At Higher Levels. When you cast this spell using a spell slot of 5th level or higher, the damage increases by 1d6 for each slot level above 4th."
"Regenerate","PHB'24","311","7th","1 Min.","1 hour","Transmutation","Touch","V, S, M (a prayer wheel)","Bard, Cleric, Druid","","A creature you touch regains 4d8 + 15 Hit Points. For the duration, the target regains 1 Hit Point at the start of each of its turns, and any severed body parts regrow after 2 minutes.",""
"Resurrection","PHB'24","312","7th","1 Hr.","Instantaneous","Necromancy","Touch","V, S, M (a diamond worth 1,000+ GP, which the spell consumes)","Bard, Cleric","","With a touch, you revive a dead creature that has been dead for no more than a century, didn't die of old age, and wasn't Undead when it died.The creature returns to life with all its Hit Points. This spell also neutralizes any poisons that affected the creature at the time of death. This spell closes all mortal wounds and restores any missing body parts.Coming back from the dead is an ordeal. The target takes a -4 penalty to D20 Tests. Every time the target finishes a Long Rest, the penalty is reduced by 1 until it becomes 0.Casting this spell to revive a creature that has been dead for 365 days or longer taxes you. Until you finish a Long Rest, you can't cast spells again, and you have Disadvantage on D20 Tests.",""
"Scrying","PHB'24","313","5th","10 Min.","Concentration, up to 10 minutes","Divination","Self","V, S, M (a focus worth 1,000+ GP, such as a crystal ball, mirror, or water-filled font)","Bard, Cleric, Druid, Warlock, Wizard","","You can see and hear a creature you choose that is on the same plane of existence as you. The target makes a Wisdom saving throw, which is modified (see the tables below) by how well you know the target and the sort of physical connection you have to it. The target doesn't know what it is making the save against, only that it feels uneasy.Your Knowledge of the Target Is...Save ModifierSecondhand (heard of the target)+5Firsthand (met the target)+0Extensive (know the target well)-5You Have the Target's...Save ModifierPicture or other likeness-2Garment or other possession-4Body part, lock of hair, or bit of nail-10On a successful save, the target isn't affected, and you can't use this spell on it again for 24 hours.On a failed save, the spell creates an Invisible, intangible sensor within 10 feet of the target. You can see and hear through the sensor as if you were there. The sensor moves with the target, remaining within 10 feet of it for the duration. If something can see the sensor, it appears as a luminous orb about the size of your fist.Instead of targeting a creature, you can target a location you have seen. When you do so, the sensor appears at that location and doesn't move.",""
"See Invisibility","PHB'24","314","2nd","Action","1 hour","Divination","Self","V, S, M (a pinch of talc)","Artificer, Bard, Sorcerer, Wizard","","For the duration, you see creatures and objects that have the Invisible condition as if they were visible, and you can see into the Ethereal Plane. Creatures and objects there appear ghostly.",""
"Seeming","PHB'24","314","5th","Action","8 hours","Illusion","30 feet","V, S","Bard, Sorcerer, Wizard","","You give an illusory appearance to each creature of your choice that you can see within range. An unwilling target can make a Charisma saving throw, and if it succeeds, it is unaffected by this spell.You can give the same appearance or different ones to the targets. The spell can change the appearance of the targets' bodies and equipment. You can make each creature seem 1 foot shorter or taller and appear heavier or lighter. A target's new appearance must have the same basic arrangement of limbs as the target, but the extent of the illusion is otherwise up to you. The spell lasts for the duration.The changes wrought by this spell fail to hold up to physical inspection. For example, if you use this spell to add a hat to a creature's outfit, objects pass through the hat.A creature that takes the Study action to examine a target can make an Intelligence (Investigation) check against your spell save DC. If it succeeds, it becomes aware that the target is disguised.",""
"Sending","PHB'24","314","3rd","Action","Instantaneous","Divination","Unlimited","V, S, M (a copper wire)","Bard, Cleric, Wizard","","You send a short message of 25 words or fewer to a creature you have met or a creature described to you by someone who has met it. The target hears the message in its mind, recognizes you as the sender if it knows you, and can answer in a like manner immediately. The spell enables targets to understand the meaning of your message.You can send the message across any distance and even to other planes of existence, but if the target is on a different plane than you, there is a 5 percent chance that the message doesn't arrive. You know if the delivery fails.Upon receiving your message, a creature can block your ability to reach it again with this spell for 8 hours. If you try to send another message during that time, you learn that you are blocked, and the spell fails.",""
"Shatter","PHB'24","316","2nd","Action","Instantaneous","Evocation","60 feet","V, S, M (a chip of mica)","Bard, Sorcerer, Wizard","","A loud noise erupts from a point of your choice within range. Each creature in a 10-foot-radius Sphere centered there makes a Constitution saving throw, taking 3d8 Thunder damage on a failed save or half as much damage on a successful one. A Construct has Disadvantage on the save.A nonmagical object that isn't being worn or carried also takes the damage if it's in the spell's area."," Using a Higher-Level Spell Slot. The damage increases by 1d8 for each spell slot level above 2."
"Silence","PHB'24","316","2nd","Action","Concentration, up to 10 minutes","Illusion (ritual)","120 feet","V, S","Bard, Cleric, Ranger","","For the duration, no sound can be created within or pass through a 20-foot-radius Sphere centered on a point you choose within range. Any creature or object entirely inside the Sphere has Immunity to Thunder damage, and creatures have the Deafened condition while entirely inside it. Casting a spell that includes a Verbal component is impossible there.",""
"Silent Image","PHB'24","317","1st","Action","Concentration, up to 10 minutes","Illusion","60 feet","V, S, M (a bit of fleece)","Bard, Sorcerer, Wizard","","You create the image of an object, a creature, or some other visible phenomenon that is no larger than a 15-foot Cube. The image appears at a spot within range and lasts for the duration. The image is purely visual; it isn't accompanied by sound, smell, or other sensory effects.As a Magic action, you can cause the image to move to any spot within range. As the image changes location, you can alter its appearance so that its movements appear natural for the image. For example, if you create an image of a creature and move it, you can alter the image so that it appears to be walking.Physical interaction with the image reveals it to be an illusion, since things can pass through it. A creature that takes a Study action to examine the image can determine that it is an illusion with a successful Intelligence (Investigation) check against your spell save DC. If a creature discerns the illusion for what it is, the creature can see through the image.",""
"Silvery Barbs","SCC","38","1st","Reaction","Instantaneous","Enchantment","60 feet","V","Bard, Bard, Sorcerer, Sorcerer, Wizard, Wizard","","You magically distract the triggering creature and turn its momentary uncertainty into encouragement for another creature. The triggering creature must reroll the d20 and use the lower roll.You can then choose a different creature you can see within range (you can choose yourself). The chosen creature has advantage on the next attack roll, ability check, or saving throw it makes within 1 minute. A creature can be empowered by only one use of this spell at a time.",""
"Skill Empowerment","XGE","165","5th","Action","Concentration, up to 1 hour","Transmutation","Touch","V, S","Artificer, Bard, Bard, Sorcerer, Sorcerer, Wizard, Wizard","","Your magic deepens a creature's understanding of its own talent. You touch one willing creature and give it expertise in one skill of your choice; until the spell ends, the creature doubles its proficiency bonus for ability checks it makes that use the chosen skill.You must choose a skill in which the target is proficient and that isn't already benefiting from an effect, such as Expertise, that doubles its proficiency bonus.",""
"Skywrite","XGE","165","2nd","Action","Concentration, up to 1 hour","Transmutation (ritual)","Sight","V, S","Artificer, Bard, Bard, Druid, Druid, Wizard, Wizard","","You cause up to ten words to form in a part of the sky you can see. The words appear to be made of cloud and remain in place for the spell's duration. The words dissipate when the spell ends. A strong wind can disperse the clouds and end the spell early.",""
"Sleep","PHB'24","317","1st","Action","Concentration, up to 1 minute","Enchantment","60 feet","V, S, M (a pinch of sand or rose petals)","Bard, Sorcerer, Wizard","","Each creature of your choice in a 5-foot-radius Sphere centered on a point within range must succeed on a Wisdom saving throw or have the Incapacitated condition until the end of its next turn, at which point it must repeat the save. If the target fails the second save, the target has the Unconscious condition for the duration. The spell ends on a target if it takes damage or someone within 5 feet of it takes an action to shake it out of the spell's effect.Creatures that don't sleep, such as elves, or that have Immunity to the Exhaustion condition automatically succeed on saves against this spell.",""
"Slow","PHB'24","318","3rd","Action","Concentration, up to 1 minute","Transmutation","120 feet","V, S, M (a drop of molasses)","Bard, Sorcerer, Wizard","","You alter time around up to six creatures of your choice in a 40-foot Cube within range. Each target must succeed on a Wisdom saving throw or be affected by this spell for the duration.An affected target's Speed is halved, it takes a -2 penalty to AC and Dexterity saving throws, and it can't take Reactions. On its turns, it can take either an action or a Bonus Action, not both, and it can make only one attack if it takes the Attack action. If it casts a spell with a Somatic component, there is a 25 percent chance the spell fails as a result of the target making the spell's gestures too slowly.An affected target repeats the save at the end of each of its turns, ending the spell on itself on a success.",""
"Speak with Animals","PHB'24","318","1st","Action","10 minutes","Divination (ritual)","Self","V, S","Bard, Druid, Ranger, Warlock","","For the duration, you can comprehend and verbally communicate with Beasts, and you can use any of the Influence action's skill options with them.Most Beasts have little to say about topics that don't pertain to survival or companionship, but at minimum, a Beast can give you information about nearby locations and monsters, including whatever it has perceived within the past day.",""
"Speak with Dead","PHB'24","318","3rd","Action","10 minutes","Necromancy","10 feet","V, S, M (burning incense)","Bard, Cleric, Wizard","","You grant the semblance of life to a corpse of your choice within range, allowing it to answer questions you pose. The corpse must have a mouth, and this spell fails if the deceased creature was Undead when it died. The spell also fails if the corpse was the target of this spell within the past 10 days.Until the spell ends, you can ask the corpse up to five questions. The corpse knows only what it knew in life, including the languages it knew. Answers are usually brief, cryptic, or repetitive, and the corpse is under no compulsion to offer a truthful answer if you are antagonistic toward it or it recognizes you as an enemy. This spell doesn't return the creature's soul to its body, only its animating spirit. Thus, the corpse can't learn new information, doesn't comprehend anything that has happened since it died, and can't speculate about future events.",""
"Speak with Plants","PHB'24","319","3rd","Action","10 minutes","Transmutation","Self","V, S","Bard, Druid, Ranger","","You imbue plants in an immobile 30-foot Emanation with limited sentience and animation, giving them the ability to communicate with you and follow your simple commands. You can question plants about events in the spell's area within the past day, gaining information about creatures that have passed, weather, and other circumstances.You can also turn Difficult Terrain caused by plant growth (such as thickets and undergrowth) into ordinary terrain that lasts for the duration. Or you can turn ordinary terrain where plants are present into Difficult Terrain that lasts for the duration.The spell doesn't enable plants to uproot themselves and move about, but they can move their branches, tendrils, and stalks for you.If a Plant creature is in the area, you can communicate with it as if you shared a common language.",""
"Spray of Cards","BMT","50","2nd","Action","Instantaneous","Conjuration","Self","V, S, M (a deck of cards)","","Bard, Bard, Sorcerer, Sorcerer, Warlock, Warlock, Wizard, Wizard","You spray a 15-foot cone of spectral cards. Each creature in that area must make a Dexterity saving throw. On a failed save, a creature takes 2d10 force damage and has the blinded condition until the end of its next turn. On a successful save, a creature takes half as much damage only."," At Higher Levels. When you cast this spell using a spell slot of 3rd level or higher, the damage increases by 1d10 for each slot level above 2nd."
"Starry Wisp","PHB'24","320","Cantrip","Action","Instantaneous","Evocation","60 feet","V, S","Bard, Druid","","You launch a mote of light at one creature or object within range. Make a ranged spell attack against the target. On a hit, the target takes 1d8 Radiant damage, and until the end of your next turn, it emits Dim Light in a 10-foot radius and can't benefit from the Invisible condition."," Cantrip Upgrade. The damage increases by 1d8 when you reach levels 5 (2d8), 11 (3d8), and 17 (4d8)."
"Stinking Cloud","PHB'24","321","3rd","Action","Concentration, up to 1 minute","Conjuration","90 feet","V, S, M (a rotten egg)","Bard, Sorcerer, Wizard","","You create a 20-foot-radius Sphere of yellow, nauseating gas centered on a point within range. The cloud is Heavily Obscured. The cloud lingers in the air for the duration or until a strong wind (such as the one created by Gust of Wind) disperses it.Each creature that starts its turn in the Sphere must succeed on a Constitution saving throw or have the Poisoned condition until the end of the current turn. While Poisoned in this way, the creature can't take an action or a Bonus Action.",""
"Suggestion","PHB'24","321","2nd","Action","Concentration, up to 8 hours","Enchantment","30 feet","V, M (a drop of honey)","Bard, Sorcerer, Warlock, Wizard","","You suggest a course of activity—described in no more than 25 words—to one creature you can see within range that can hear and understand you. The suggestion must sound achievable and not involve anything that would obviously deal damage to the target or its allies. For example, you could say, ""Fetch the key to the cult's treasure vault, and give the key to me."" Or you could say, ""Stop fighting, leave this library peacefully, and don't return.""The target must succeed on a Wisdom saving throw or have the Charmed condition for the duration or until you or your allies deal damage to the target. The Charmed target pursues the suggestion to the best of its ability. The suggested activity can continue for the entire duration, but if the suggested activity can be completed in a shorter time, the spell ends for the target upon completing it.",""
"Symbol","PHB'24","329","7th","1 Min.","Until dispelled or triggered","Abjuration","Touch","V, S, M (powdered diamond worth 1,000+ GP, which the spell consumes)","Bard, Cleric, Druid, Wizard","","You inscribe a harmful glyph either on a surface (such as a section of floor or wall) or within an object that can be closed (such as a book or chest). The glyph can cover an area no larger than 10 feet in diameter. If you choose an object, it must remain in place; if it is moved more than 10 feet from where you cast this spell, the glyph is broken, and the spell ends without being triggered.The glyph is nearly imperceptible and requires a successful Wisdom (Perception) check against your spell save DC to notice.When you inscribe the glyph, you set its trigger and choose which effect the symbol bears: Death, Discord, Fear, Pain, Sleep, or Stunning. Each one is explained below. Set the Trigger. You decide what triggers the glyph when you cast the spell. For glyphs inscribed on a surface, common triggers include touching or stepping on the glyph, removing another object covering it, or approaching within a certain distance of it. For glyphs inscribed within an object, common triggers include opening that object or seeing the glyph.You can refine the trigger so that only creatures of certain types activate it (for example, the glyph could be set to affect Aberrations). You can also set conditions for creatures that don't trigger the glyph, such as those who say a certain password.Once triggered, the glyph glows, filling a 60-foot-radius Sphere with Dim Light for 10 minutes, after which time the spell ends. Each creature in the Sphere when the glyph activates is targeted by its effect, as is a creature that enters the Sphere for the first time on a turn or ends its turn there. A creature is targeted only once per turn. Death. Each target makes a Constitution saving throw, taking 10d10 Necrotic damage on a failed save or half as much damage on a successful save. Discord. Each target makes a Wisdom saving throw. On a failed save, a target argues with other creatures for 1 minute. During this time, it is incapable of meaningful communication and has Disadvantage on attack rolls and ability checks. Fear. Each target must succeed on a Wisdom saving throw or have the Frightened condition for 1 minute. While Frightened, the target must move at least 30 feet away from the glyph on each of its turns, if able. Pain. Each target must succeed on a Constitution saving throw or have the Incapacitated condition for 1 minute. Sleep. Each target must succeed on a Wisdom saving throw or have the Unconscious condition for 10 minutes. A creature awakens if it takes damage or if someone takes an action to shake it awake. Stunning. Each target must succeed on a Wisdom saving throw or have the Stunned condition for 1 minute.",""
"Synaptic Static","PHB'24","330","5th","Action","Instantaneous","Enchantment","120 feet","V, S","Bard, Sorcerer, Warlock, Wizard","","You cause psychic energy to erupt at a point within range. Each creature in a 20-foot-radius Sphere centered on that point makes an Intelligence saving throw, taking 8d6 Psychic damage on a failed save or half as much damage on a successful one.On a failed save, a target also has muddled thoughts for 1 minute. During that time, it subtracts 1d6 from all its attack rolls and ability checks, as well as any Constitution saving throws to maintain Concentration. The target makes an Intelligence saving throw at the end of each of its turns, ending the effect on itself on a success.",""
