"Name","Source","Page","Level","Casting Time","Duration","School","Range","Components","Classes","Optional/Variant Classes","Text","At Higher Levels"
"Greater Invisibility","PHB'24","281","4th","Action","Concentration, up to 1 minute","Illusion","Touch","V, S","Bard, Sorcerer, Wizard","","A creature you touch has the Invisible condition until the spell ends.",""
"Greater Restoration","PHB'24","281","5th","Action","Instantaneous","Abjuration","Touch","V, S, M (diamond dust worth 100+ GP, which the spell consumes)","Artificer, Bard, Cleric, Druid, Paladin, Ranger","","You touch a creature and magically remove one of the following effects from it:1 Exhaustion levelThe Charmed or Petrified conditionA curse, including the target's Attunement to a cursed magic itemAny reduction to one of the target's ability scoresAny reduction to the target's Hit Point maximum",""
"Guards and Wards","PHB'24","282","6th","1 Hr.","24 hours","Abjuration","Touch","V, S, M (a silver rod worth 10+ GP)","Bard, Wizard","","You create a ward that protects up to 2,500 square feet of floor space. The warded area can be up to 20 feet tall, and you shape it as one 50-foot square, one hundred 5-foot squares that are contiguous, or twenty-five 10-foot squares that are contiguous.When you cast this spell, you can specify individuals that are unaffected by the spell's effects. You can also specify a password that, when spoken aloud within 5 feet of the warded area, makes the speaker immune to its effects.The spell creates the effects below within the warded area. Dispel Magic has no effect on Guards and Wards itself, but each of the following effects can be dispelled. If all four are dispelled, Guards and Wards ends. If you cast the spell every day for 365 days on the same area, the spell thereafter lasts until all its effects are dispelled. Corridors. Fog fills all the warded corridors, making them Heavily Obscured. In addition, at each intersection or branching passage offering a choice of direction, there is a 50 percent chance that a creature other than you believes it is going in the opposite direction from the one it chooses. Doors. All doors in the warded area are magically locked, as if sealed by the Arcane Lock spell. In addition, you can cover up to ten doors with an illusion to make them appear as plain sections of wall. Stairs. Webs fill all stairs in the warded area from top to bottom, as in the Web spell. These strands regrow in 10 minutes if they are destroyed while Guards and Wards lasts. Other Spell Effect. Place one of the following magical effects within the warded area:Dancing Lights in four corridors, with a simple program that the lights repeat as long as Guards and Wards lastsMagic Mouth in two locationsStinking Cloud in two locations (the vapors return within 10 minutes if dispersed while Guards and Wards lasts)Gust of Wind in one corridor or room (the wind blows continuously while the spell lasts)Suggestion in one 5-foot square; any creature that enters that square receives the suggestion mentally",""
"Hallucinatory Terrain","PHB'24","283","4th","10 Min.","24 hours","Illusion","300 feet","V, S, M (a mushroom)","Bard, Druid, Warlock, Wizard","","You make natural terrain in a 150-foot Cube in range look, sound, and smell like another sort of natural terrain. Thus, open fields or a road can be made to resemble a swamp, hill, crevasse, or some other difficult or impassable terrain. A pond can be made to seem like a grassy meadow, a precipice like a gentle slope, or a rock-strewn gully like a wide and smooth road. Manufactured structures, equipment, and creatures within the area aren't changed.The tactile characteristics of the terrain are unchanged, so creatures entering the area are likely to notice the illusion. If the difference isn't obvious by touch, a creature examining the illusion can take the Study action to make an Intelligence (Investigation) check against your spell save DC to disbelieve it. If a creature discerns that the terrain is illusory, the creature sees a vague image superimposed on the real terrain.",""
"Healing Word","PHB'24","284","1st","Bonus","Instantaneous","Abjuration","60 feet","V","Bard, Cleric, Druid","","A creature of your choice that you can see within range regains Hit Points equal to 2d4 plus your spellcasting ability modifier."," Using a Higher-Level Spell Slot. The healing increases by 2d4 for each spell slot level above 1."
"Heat Metal","PHB'24","284","2nd","Action","Concentration, up to 1 minute","Transmutation","60 feet","V, S, M (a piece of iron and a flame)","Artificer, Bard, Druid","","Choose a manufactured metal object, such as a metal weapon or a suit of Heavy or Medium metal armor, that you can see within range. You cause the object to glow red-hot. Any creature in physical contact with the object takes 2d8 Fire damage when you cast the spell. Until the spell ends, you can take a Bonus Action on each of your later turns to deal this damage again if the object is within range.If a creature is holding or wearing the object and takes the damage from it, the creature must succeed on a Constitution saving throw or drop the object if it can. If it doesn't drop the object, it has Disadvantage on attack rolls and ability checks until the start of your next turn."," Using a Higher-Level Spell Slot. The damage increases by 1d8 for each spell slot level above 2."
"Heroes' Feast","PHB'24","284","6th","10 Min.","Instantaneous","Conjuration","Self","V, S, M (a gem-encrusted bowl worth 1,000+ GP, which the spell consumes)","Bard, Cleric, Druid","","You conjure a feast that appears on a surface in an unoccupied 10-foot Cube next to you. The feast takes 1 hour to consume and disappears at the end of that time, and the beneficial effects don't set in until this hour is over. Up to twelve creatures can partake of the feast.A creature that partakes gains several benefits, which last for 24 hours. The creature has Resistance to Poison damage, and it has Immunity to the Frightened and Poisoned conditions. Its Hit Point maximum also increases by 2d10, and it gains the same number of Hit Points.",""
"Heroism","PHB'24","285","1st","Action","Concentration, up to 1 minute","Enchantment","Touch","V, S","Bard, Paladin","","A willing creature you touch is imbued with bravery. Until the spell ends, the creature is immune to the Frightened condition and gains Temporary Hit Points equal to your spellcasting ability modifier at the start of each of its turns."," Using a Higher-Level Spell Slot. You can target one additional creature for each spell slot level above 1."
"Hold Monster","PHB'24","285","5th","Action","Concentration, up to 1 minute","Enchantment","90 feet","V, S, M (a straight piece of iron)","Bard, Sorcerer, Warlock, Wizard","","Choose a creature that you can see within range. The target must succeed on a Wisdom saving throw or have the Paralyzed condition for the duration. At the end of each of its turns, the target repeats the save, ending the spell on itself on a success."," Using a Higher-Level Spell Slot. You can target one additional creature for each spell slot level above 5."
"Hold Person","PHB'24","286","2nd","Action","Concentration, up to 1 minute","Enchantment","60 feet","V, S, M (a straight piece of iron)","Bard, Cleric, Druid, Sorcerer, Warlock, Wizard","","Choose a Humanoid that you can see within range. The target must succeed on a Wisdom saving throw or have the Paralyzed condition for the duration. At the end of each of its turns, the target repeats the save, ending the spell on itself on a success."," Using a Higher-Level Spell Slot. You can target one additional Humanoid for each spell slot level above 2."
"Hypnotic Pattern","PHB'24","287","3rd","Action","Concentration, up to 1 minute","Illusion","120 feet","S, M (a pinch of confetti)","Bard, Sorcerer, Warlock, Wizard","","You create a twisting pattern of colors in a 30-foot Cube within range. The pattern appears for a moment and vanishes. Each creature in the area who can see the pattern must succeed on a Wisdom saving throw or have the Charmed condition for the duration. While Charmed, the creature has the Incapacitated condition and a Speed of 0.The spell ends for an affected creature if it takes any damage or if someone else uses an action to shake the creature out of its stupor.",""
"Identify","PHB'24","287","1st","1 Min.","Instantaneous","Divination (ritual)","Touch","V, S, M (a pearl worth 100+ GP)","Artificer, Bard, Wizard","","You touch an object throughout the spell's casting. If the object is a magic item or some other magical object, you learn its properties and how to use them, whether it requires Attunement, and how many charges it has, if any. You learn whether any ongoing spells are affecting the item and what they are. If the item was created by a spell, you learn that spell's name.If you instead touch a creature throughout the casting, you learn which ongoing spells, if any, are currently affecting it.",""
"Illusory Script","PHB'24","288","1st","1 Min.","10 days","Illusion (ritual)","Touch","S, M (ink worth 10+ GP, which the spell consumes)","Bard, Warlock, Wizard","","You write on parchment, paper, or another suitable material and imbue it with an illusion that lasts for the duration. To you and any creatures you designate when you cast the spell, the writing appears normal, seems to be written in your hand, and conveys whatever meaning you intended when you wrote the text. To all others, the writing appears as if it were written in an unknown or magical script that is unintelligible. Alternatively, the illusion can alter the meaning, handwriting, and language of the text, though the language must be one you know.If the spell is dispelled, the original script and the illusion both disappear.A creature that has Truesight can read the hidden message.",""
"Intellect Fortress","TCE","107","3rd","Action","Concentration, up to 1 hour","Abjuration","30 feet","V","Artificer","Bard, Bard, Sorcerer, Sorcerer, Warlock, Warlock, Wizard, Wizard","For the duration, you or one willing creature you can see within range has resistance to psychic damage, as well as advantage on Intelligence, Wisdom, and Charisma saving throws."," At Higher Levels. When you cast this spell using a spell slot of 4th level or higher, you can target one additional creature for each slot level above 3rd. The creatures must be within 30 feet of each other when you target them."
"Invisibility","PHB'24","289","2nd","Action","Concentration, up to 1 hour","Illusion","Touch","V, S, M (an eyelash in gum arabic)","Artificer, Bard, Sorcerer, Warlock, Wizard","","A creature you touch has the Invisible condition until the spell ends. The spell ends early immediately after the target makes an attack roll, deals damage, or casts a spell."," Using a Higher-Level Spell Slot. You can target one additional creature for each spell slot level above 2."
"Kinetic Jaunt","SCC","37","2nd","Bonus","Concentration, up to 1 minute","Transmutation","Self","S","Artificer, Bard, Bard, Sorcerer, Sorcerer, Wizard, Wizard","","You magically empower your movement with dance-like steps, giving yourself the following benefits for the duration.Your walking speed increases by 10 feet.You don't provoke opportunity attacks.You can move through the space of another creature, and it doesn't count as difficult terrain. If you end your turn in another creature's space, you are shunted to the last unoccupied space you occupied, and you take 1d8 force damage.",""
"Knock","PHB'24","290","2nd","Action","Instantaneous","Transmutation","60 feet","V","Bard, Sorcerer, Wizard","","Choose an object that you can see within range. The object can be a door, a box, a chest, a set of manacles, a padlock, or another object that contains a mundane or magical means that prevents access.A target that is held shut by a mundane lock or that is stuck or barred becomes unlocked, unstuck, or unbarred. If the object has multiple locks, only one of them is unlocked.If the target is held shut by Arcane Lock, that spell is suppressed for 10 minutes, during which time the target can be opened and closed.When you cast the spell, a loud knock, audible up to 300 feet away, emanates from the target.",""
"Legend Lore","PHB'24","290","5th","10 Min.","Instantaneous","Divination","Self","V, S, M (incense worth 250+ GP, which the spell consumes, and four ivory strips worth 50+ GP each)","Bard, Cleric, Wizard","","Name or describe a famous person, place, or object. The spell brings to your mind a brief summary of the significant lore about that famous thing, as described by the DM.The lore might consist of important details, amusing revelations, or even secret lore that has never been widely known. The more information you already know about the thing, the more precise and detailed the information you receive is. That information is accurate but might be couched in figurative language or poetry, as determined by the DM.If the famous thing you chose isn't actually famous, you hear sad musical notes played on a trombone, and the spell fails.",""
"Leomund's Tiny Hut","PHB'24","291","3rd","1 Min.","8 hours","Evocation (ritual)","Self","V, S, M (a crystal bead)","Bard, Wizard","","A 10-foot Emanation springs into existence around you and remains stationary for the duration. The spell fails when you cast it if the Emanation isn't big enough to fully encapsulate all creatures in its area.Creatures and objects within the Emanation when you cast the spell can move through it freely. All other creatures and objects are barred from passing through it. Spells of level 3 or lower can't be cast through it, and the effects of such spells can't extend into it.The atmosphere inside the Emanation is comfortable and dry, regardless of the weather outside. Until the spell ends, you can command the interior to have Dim Light or Darkness (no action required). The Emanation is opaque from the outside and of any color you choose, but it's transparent from the inside.The spell ends early if you leave the Emanation or if you cast it again.",""
"Lesser Restoration","PHB'24","291","2nd","Bonus","Instantaneous","Abjuration","Touch","V, S","Artificer, Bard, Cleric, Druid, Paladin, Ranger","","You touch a creature and end one condition on it: Blinded, Deafened, Paralyzed, or Poisoned.",""
"Light","PHB'24","292","Cantrip","Action","1 hour","Evocation","Touch","V, M (a firefly or phosphorescent moss)","Artificer, Bard, Cleric, Sorcerer, Wizard","","You touch one Large or smaller object that isn't being worn or carried by someone else. Until the spell ends, the object sheds Bright Light in a 20-foot radius and Dim Light for an additional 20 feet. The light can be colored as you like.Covering the object with something opaque blocks the light. The spell ends if you cast it again.",""
"Locate Animals or Plants","PHB'24","292","2nd","Action","Instantaneous","Divination (ritual)","Self","V, S, M (fur from a bloodhound)","Bard, Druid, Ranger","","Describe or name a specific kind of Beast, Plant creature, or nonmagical plant. You learn the direction and distance to the closest creature or plant of that kind within 5 miles, if any are present.",""
"Locate Creature","PHB'24","292","4th","Action","Concentration, up to 1 hour","Divination","Self","V, S, M (fur from a bloodhound)","Bard, Cleric, Druid, Paladin, Ranger, Wizard","","Describe or name a creature that is familiar to you. You sense the direction to the creature's location if that creature is within 1,000 feet of you. If the creature is moving, you know the direction of its movement.The spell can locate a specific creature known to you or the nearest creature of a specific kind (such as a human or a unicorn) if you have seen such a creature up close—within 30 feet—at least once. If the creature you described or named is in a different form, such as under the effects of a Flesh to Stone or Polymorph spell, this spell doesn't locate the creature.This spell can't locate a creature if any thickness of lead blocks a direct path between you and the creature.",""
"Locate Object","PHB'24","293","2nd","Action","Concentration, up to 10 minutes","Divination","Self","V, S, M (a forked twig)","Bard, Cleric, Druid, Paladin, Ranger, Wizard","","Describe or name an object that is familiar to you. You sense the direction to the object's location if that object is within 1,000 feet of you. If the object is in motion, you know the direction of its movement.The spell can locate a specific object known to you if you have seen it up close—within 30 feet—at least once. Alternatively, the spell can locate the nearest object of a particular kind, such as a certain kind of apparel, jewelry, furniture, tool, or weapon.This spell can't locate an object if any thickness of lead blocks a direct path between you and the object.",""
"Longstrider","PHB'24","293","1st","Action","1 hour","Transmutation","Touch","V, S, M (a pinch of dirt)","Artificer, Bard, Druid, Ranger, Wizard","","You touch a creature. The target's Speed increases by 10 feet until the spell ends."," Using a Higher-Level Spell Slot. You can target one additional creature for each spell slot level above 1."
"Mage Hand","PHB'24","293","Cantrip","Action","1 minute","Conjuration","30 feet","V, S","Artificer, Bard, Sorcerer, Warlock, Wizard","","A spectral, floating hand appears at a point you choose within range. The hand lasts for the duration. The hand vanishes if it is ever more than 30 feet away from you or if you cast this spell again.When you cast the spell, you can use the hand to manipulate an object, open an unlocked door or container, stow or retrieve an item from an open container, or pour the contents out of a vial.As a Magic action on your later turns, you can control the hand thus again. As part of that action, you can move the hand up to 30 feet.The hand can't attack, activate magic items, or carry more than 10 pounds.",""
"Magic Mouth","PHB'24","295","2nd","1 Min.","Until dispelled","Illusion (ritual)","30 feet","V, S, M (jade dust worth 10+ GP, which the spell consumes)","Artificer, Bard, Wizard","","You implant a message within an object in range—a message that is uttered when a trigger condition is met. Choose an object that you can see and that isn't being worn or carried by another creature. Then speak the message, which must be 25 words or fewer, though it can be delivered over as long as 10 minutes. Finally, determine the circumstance that will trigger the spell to deliver your message.When that trigger occurs, a magical mouth appears on the object and recites the message in your voice and at the same volume you spoke. If the object you chose has a mouth or something that looks like a mouth (for example, the mouth of a statue), the magical mouth appears there, so the words appear to come from the object's mouth. When you cast this spell, you can have the spell end after it delivers its message, or it can remain and repeat its message whenever the trigger occurs.The trigger can be as general or as detailed as you like, though it must be based on visual or audible conditions that occur within 30 feet of the object. For example, you could instruct the mouth to speak when any creature moves within 30 feet of the object or when a silver bell rings within 30 feet of it.",""
"Major Image","PHB'24","295","3rd","Action","Concentration, up to 10 minutes","Illusion","120 feet","V, S, M (a bit of fleece)","Bard, Sorcerer, Warlock, Wizard","","You create the image of an object, a creature, or some other visible phenomenon that is no larger than a 20-foot Cube. The image appears at a spot that you can see within range and lasts for the duration. It seems real, including sounds, smells, and temperature appropriate to the thing depicted, but it can't deal damage or cause conditions.If you are within range of the illusion, you can take a Magic action to cause the image to move to any other spot within range. As the image changes location, you can alter its appearance so that its movements appear natural for the image. For example, if you create an image of a creature and move it, you can alter the image so that it appears to be walking. Similarly, you can cause the illusion to make different sounds at different times, even making it carry on a conversation, for example.Physical interaction with the image reveals it to be an illusion, for things can pass through it. A creature that takes a Study action to examine the image can determine that it is an illusion with a successful Intelligence (Investigation) check against your spell save DC. If a creature discerns the illusion for what it is, the creature can see through the image, and its other sensory qualities become faint to the creature."," Using a Higher-Level Spell Slot. The spell lasts until dispelled, without requiring Concentration, if cast with a level 4+ spell slot."
"Mass Cure Wounds","PHB'24","296","5th","Action","Instantaneous","Abjuration","60 feet","V, S","Bard, Cleric, Druid","","A wave of healing energy washes out from a point you can see within range. Choose up to six creatures in a 30-foot-radius Sphere centered on that point. Each target regains Hit Points equal to 5d8 plus your spellcasting ability modifier."," Using a Higher-Level Spell Slot. The healing increases by 1d8 for each spell slot level above 5."
"Mass Healing Word","PHB'24","296","3rd","Bonus","Instantaneous","Abjuration","60 feet","V","Bard, Cleric","","Up to six creatures of your choice that you can see within range regain Hit Points equal to 2d4 plus your spellcasting ability modifier."," Using a Higher-Level Spell Slot. The healing increases by 1d4 for each spell slot level above 3."
"Mass Polymorph","XGE","160","9th","Action","Concentration, up to 1 hour","Transmutation","120 feet","V, S, M (a caterpillar cocoon)","Bard, Bard, Sorcerer, Sorcerer, Wizard, Wizard","","You transform up to ten creatures of your choice that you can see within range. An unwilling target must succeed on a Wisdom saving throw to resist the transformation. An unwilling shapechanger automatically succeeds on the save.Each target assumes a beast form of your choice, and you can choose the same form or different ones for each target. The new form can be any beast you have seen whose challenge rating is equal to or less than the target's (or half the target's level, if the target doesn't have a challenge rating). The target's game statistics, including mental ability scores, are replaced by the statistics of the chosen beast, but the target retains its hit points, alignment, and personality.Each target gains a number of temporary hit points equal to the hit points of its new form. These temporary hit points can't be replaced by temporary hit points from another source. A target reverts to its normal form when it has no more temporary hit points or it dies. If the spell ends before then, the creature loses all its temporary hit points and reverts to its normal form.The creature is limited in the actions it can perform by the nature of its new form. It can't speak, cast spells, or do anything else that requires hands or speech.The target's gear melds into the new form. The target can't activate, use, wield, or otherwise benefit from any of its equipment.",""
"Mass Suggestion","PHB'24","296","6th","Action","24 hours","Enchantment","60 feet","V, M (a snake's tongue)","Bard, Sorcerer, Wizard","","You suggest a course of activity—described in no more than 25 words—to twelve or fewer creatures you can see within range that can hear and understand you. The suggestion must sound achievable and not involve anything that would obviously deal damage to any of the targets or their allies. For example, you could say, ""Walk to the village down that road, and help the villagers there harvest crops until sunset."" Or you could say, ""Now is not the time for violence. Drop your weapons, and dance! Stop in an hour.""Each target must succeed on a Wisdom saving throw or have the Charmed condition for the duration or until you or your allies deal damage to the target. Each Charmed target pursues the suggestion to the best of its ability. The suggested activity can continue for the entire duration, but if the suggested activity can be completed in a shorter time, the spell ends for a target upon completing it."," Using a Higher-Level Spell Slot. The duration is longer with a spell slot of level 7 (10 days), 8 (30 days), or 9 (366 days)."
"Mending","PHB'24","297","Cantrip","1 Min.","Instantaneous","Transmutation","Touch","V, S, M (two lodestones)","Artificer, Bard, Cleric, Druid, Sorcerer, Wizard","","This spell repairs a single break or tear in an object you touch, such as a broken chain link, two halves of a broken key, a torn cloak, or a leaking wineskin. As long as the break or tear is no larger than 1 foot in any dimension, you mend it, leaving no trace of the former damage.This spell can physically repair a magic item, but it can't restore magic to such an object.",""
"Message","PHB'24","298","Cantrip","Action","1 round","Transmutation","120 feet","S, M (a copper wire)","Artificer, Bard, Druid, Sorcerer, Wizard","","You point toward a creature within range and whisper a message. The target (and only the target) hears the message and can reply in a whisper that only you can hear.You can cast this spell through solid objects if you are familiar with the target and know it is beyond the barrier. Magical silence; 1 foot of stone, metal, or wood; or a thin sheet of lead blocks the spell.",""
"Mind Blank","PHB'24","298","8th","Action","24 hours","Abjuration","Touch","V, S","Bard, Wizard","","Until the spell ends, one willing creature you touch has Immunity to Psychic damage and the Charmed condition. The target is also unaffected by anything that would sense its emotions or alignment, read its thoughts, or magically detect its location, and no spell—not even Wish—can gather information about the target, observe it remotely, or control its mind.",""
