"Name","Source","Page","Level","Casting Time","Duration","School","Range","Components","Classes","Optional/Variant Classes","Text","At Higher Levels"
"Aid","PHB'24","239","2nd","Action","8 hours","Abjuration","30 feet","V, S, M (a strip of white cloth)","Artificer, Bard, Cleric, Druid, Paladin, Ranger","","Choose up to three creatures within range. Each target's Hit Point maximum and current Hit Points increase by 5 for the duration."," Using a Higher-Level Spell Slot. Each target's Hit Points increase by 5 for each spell slot level above 2."
"Animal Friendship","PHB'24","239","1st","Action","24 hours","Enchantment","30 feet","V, S, M (a morsel of food)","Bard, Druid, Ranger","","Target a Beast that you can see within range. The target must succeed on a Wisdom saving throw or have the Charmed condition for the duration. If you or one of your allies deals damage to the target, the spells ends."," Using a Higher-Level Spell Slot. You can target one additional Beast for each spell slot level above 1."
"Animal Messenger","PHB'24","240","2nd","Action","24 hours","Enchantment (ritual)","30 feet","V, S, M (a morsel of food)","Bard, Druid, Ranger","","A Tiny Beast of your choice that you can see within range must succeed on a Charisma saving throw, or it attempts to deliver a message for you (if the target's Challenge Rating isn't 0, it automatically succeeds). You specify a location you have visited and a recipient who matches a general description, such as ""a person dressed in the uniform of the town guard"" or ""a red-haired dwarf wearing a pointed hat."" You also communicate a message of up to twenty-five words. The Beast travels for the duration toward the specified location, covering about 25 miles per 24 hours or 50 miles if the Beast can fly.When the Beast arrives, it delivers your message to the creature that you described, mimicking your communication. If the Beast doesn't reach its destination before the spell ends, the message is lost, and the Beast returns to where you cast the spell."," Using a Higher-Level Spell Slot. The spell's duration increases by 48 hours for each spell slot level above 2."
"Animate Objects","PHB'24","240","5th","Action","Concentration, up to 1 minute","Transmutation","120 feet","V, S","Artificer, Bard, Sorcerer, Wizard","","Objects animate at your command. Choose a number of nonmagical objects within range that aren't being worn or carried, aren't fixed to a surface, and aren't Gargantuan. The maximum number of objects is equal to your spellcasting ability modifier; for this number, a Medium or smaller target counts as one object, a Large target counts as two, and a Huge target counts as three.Each target animates, sprouts legs, and becomes a Construct that uses the Animated Object stat block; this creature is under your control until the spell ends or until it is reduced to 0 Hit Points. Each creature you make with this spell is an ally to you and your allies. In combat, it shares your Initiative count and takes its turn immediately after yours.Until the spell ends, you can take a Bonus Action to mentally command any creature you made with this spell if the creature is within 500 feet of you (if you control multiple creatures, you can command any of them at the same time, issuing the same command to each one). If you issue no commands, the creature takes the Dodge action and moves only to avoid harm. When the creature drops to 0 Hit Points, it reverts to its object form, and any remaining damage carries over to that form."," Using a Higher-Level Spell Slot. The creature's Slam damage increases by 1d4 (Medium or smaller), 1d6 (Large), or 1d12 (Huge) for each spell slot level above 5."
"Antagonize","BMT","50","3rd","Action","Instantaneous","Enchantment","30 feet","V, S, M (a playing card depicting a rogue)","","Bard, Bard, Sorcerer, Sorcerer, Warlock, Warlock, Wizard, Wizard","You whisper magical words that antagonize one creature of your choice within range. The target must make a Wisdom saving throw. On a failed save, the target takes 4d4 psychic damage and must immediately use its reaction to make a melee attack against another creature of your choice that you can see. If the target can't make this attack (for example, because there is no one within its reach or because its reaction is unavailable), the target instead has disadvantage on the next attack roll it makes before the start of your next turn. On a successful save, the target takes half as much damage only."," At Higher Levels. When you cast this spell using a spell slot of 4th level or higher, the damage increases by 1d4 for each slot level above 3rd."
"Antipathy/Sympathy","PHB'24","242","8th","1 Hr.","10 days","Enchantment","60 feet","V, S, M (a mix of vinegar and honey)","Bard, Druid, Wizard","","As you cast the spell, choose whether it creates antipathy or sympathy, and target one creature or object that is Huge or smaller. Then specify a kind of creature, such as red dragons, goblins, or vampires. A creature of the chosen kind makes a Wisdom saving throw when it comes within 120 feet of the target. Your choice of antipathy or sympathy determines what happens to a creature when it fails that save:Antipathy. The creature has the Frightened condition. The Frightened creature must use its movement on its turns to get as far away as possible from the target, moving by the safest route.Sympathy. The creature has the Charmed condition. The Charmed creature must use its movement on its turns to get as close as possible to the target, moving by the safest route. If the creature is within 5 feet of the target, the creature can't willingly move away. If the target damages the Charmed creature, that creature can make a Wisdom saving throw to end the effect, as described below. Ending the Effect. If the Frightened or Charmed creature ends its turn more than 120 feet away from the target, the creature makes a Wisdom saving throw. On a successful save, the creature is no longer affected by the target. A creature that successfully saves against this effect is immune to it for 1 minute, after which it can be affected again.",""
"Awaken","PHB'24","244","5th","8 Hr.","Instantaneous","Transmutation","Touch","V, S, M (an agate worth 1,000+ GP, which the spell consumes)","Bard, Druid","","You spend the casting time tracing magical pathways within a precious gemstone, and then touch the target. The target must be either a Beast or Plant creature with an Intelligence of 3 or less or a natural plant that isn't a creature. The target gains an Intelligence of 10 and the ability to speak one language you know. If the target is a natural plant, it becomes a Plant creature and gains the ability to move its limbs, roots, vines, creepers, and so forth, and it gains senses similar to a human's. The DM chooses statistics appropriate for the awakened Plant, such as the statistics for the Awakened Shrub or Awakened Tree in the Monster Manual.The awakened target has the Charmed condition for 30 days or until you or your allies deal damage to it. When that condition ends, the awakened creature chooses its attitude toward you.",""
"Bane","PHB'24","245","1st","Action","Concentration, up to 1 minute","Enchantment","30 feet","V, S, M (a drop of blood)","Bard, Cleric, Warlock","","Up to three creatures of your choice that you can see within range must each make a Charisma saving throw. Whenever a target that fails this save makes an attack roll or a saving throw before the spell ends, the target must subtract 1d4 from the attack roll or save."," Using a Higher-Level Spell Slot. You can target one additional creature for each spell slot level above 1."
"Befuddlement","PHB'24","245","8th","Action","Instantaneous","Enchantment","150 feet","V, S, M (a key ring with no keys)","Bard, Druid, Warlock, Wizard","","You blast the mind of a creature that you can see within range. The target makes an Intelligence saving throw.On a failed save, the target takes 10d12 Psychic damage and can't cast spells or take the Magic action. At the end of every 30 days, the target repeats the save, ending the effect on a success. The effect can also be ended by the Greater Restoration, Heal, or Wish spell.On a successful save, the target takes half as much damage only.",""
"Bestow Curse","PHB'24","246","3rd","Action","Concentration, up to 1 minute","Necromancy","Touch","V, S","Bard, Cleric, Wizard","","You touch a creature, which must succeed on a Wisdom saving throw or become cursed for the duration. Until the curse ends, the target suffers one of the following effects of your choice:Choose one ability. The target has Disadvantage on ability checks and saving throws made with that ability.The target has Disadvantage on attack rolls against you.In combat, the target must succeed on a Wisdom saving throw at the start of each of its turns or be forced to take the Dodge action on that turn.If you deal damage to the target with an attack roll or a spell, the target takes an extra 1d8 Necrotic damage."," Using a Higher-Level Spell Slot. If you cast this spell using a level 4 spell slot, you can maintain Concentration on it for up to 10 minutes. If you use a level 5+ spell slot, the spell doesn't require Concentration, and the duration becomes 8 hours (level 5-6 slot) or 24 hours (level 7-8 slot). If you use a level 9 spell slot, the spell lasts until dispelled."
"Blade Ward","PHB'24","247","Cantrip","Action","Concentration, up to 1 minute","Abjuration","Self","V, S","Bard, Sorcerer, Warlock, Wizard","","Whenever a creature makes an attack roll against you before the spell ends, the attacker subtracts 1d4 from the attack roll.",""
"Blindness/Deafness","PHB'24","248","2nd","Action","1 minute","Transmutation","120 feet","V","Bard, Cleric, Sorcerer, Wizard","","One creature that you can see within range must succeed on a Constitution saving throw, or it has the Blinded or Deafened condition (your choice) for the duration. At the end of each of its turns, the target repeats the save, ending the spell on itself on a success."," Using a Higher-Level Spell Slot. You can target one additional creature for each spell slot level above 2."
"Borrowed Knowledge","SCC","37","2nd","Action","1 hour","Divination","Self","V, S, M (a book worth at least 25 gp)","Bard, Bard, Cleric, Cleric, Warlock, Warlock, Wizard, Wizard","","You draw on knowledge from spirits of the past. Choose one skill in which you lack proficiency. For the spell's duration, you have proficiency in the chosen skill. The spell ends early if you cast it again.",""
"Calm Emotions","PHB'24","249","2nd","Action","Concentration, up to 1 minute","Enchantment","60 feet","V, S","Bard, Cleric","","Each Humanoid in a 20-foot-radius Sphere centered on a point you choose within range must succeed on a Charisma saving throw or be affected by one of the following effects (choose for each creature):The creature has Immunity to the Charmed and Frightened conditions until the spell ends. If the creature was already Charmed or Frightened, those conditions are suppressed for the duration.The creature becomes Indifferent about creatures of your choice that it's Hostile toward. This indifference ends if the target takes damage or witnesses its allies taking damage. When the spell ends, the creature's attitude returns to normal.",""
"Catnap","XGE","151","3rd","Action","10 minutes","Enchantment","30 feet","S, M (a pinch of sand)","Artificer, Bard, Bard, Sorcerer, Sorcerer, Wizard, Wizard","","You make a calming gesture, and up to three willing creatures of your choice that you can see within range fall unconscious for the spell's duration. The spell ends on a target early if it takes damage or someone uses an action to shake or slap it awake. If a target remains unconscious for the full duration, that target gains the benefit of a short rest, and it can't be affected by this spell again until it finishes a long rest."," At Higher Levels. When you cast this spell using a spell slot of 4th level or higher, you can target one additional willing creature for each slot level above 3rd."
"Charm Monster","PHB'24","249","4th","Action","1 hour","Enchantment","30 feet","V, S","Bard, Druid, Sorcerer, Warlock, Wizard","","One creature you can see within range makes a Wisdom saving throw. It does so with Advantage if you or your allies are fighting it. On a failed save, the target has the Charmed condition until the spell ends or until you or your allies damage it. The Charmed creature is Friendly to you. When the spell ends, the target knows it was Charmed by you."," Using a Higher-Level Spell Slot. You can target one additional creature for each spell slot level above 4."
"Charm Person","PHB'24","249","1st","Action","1 hour","Enchantment","30 feet","V, S","Bard, Druid, Sorcerer, Warlock, Wizard","","One Humanoid you can see within range makes a Wisdom saving throw. It does so with Advantage if you or your allies are fighting it. On a failed save, the target has the Charmed condition until the spell ends or until you or your allies damage it. The Charmed creature is Friendly to you. When the spell ends, the target knows it was Charmed by you."," Using a Higher-Level Spell Slot. You can target one additional creature for each spell slot level above 1."
"Clairvoyance","PHB'24","250","3rd","10 Min.","Concentration, up to 10 minutes","Divination","1 mile","V, S, M (a focus worth 100+ GP, either a jeweled horn for hearing or a glass eye for seeing)","Bard, Cleric, Sorcerer, Wizard","","You create an Invisible sensor within range in a location familiar to you (a place you have visited or seen before) or in an obvious location that is unfamiliar to you (such as behind a door, around a corner, or in a grove of trees). The intangible, invulnerable sensor remains in place for the duration.When you cast the spell, choose seeing or hearing. You can use the chosen sense through the sensor as if you were in its space. As a Bonus Action, you can switch between seeing and hearing.A creature that sees the sensor (such as a creature benefiting from See Invisibility or Truesight) sees a luminous orb about the size of your fist.",""
"Cloud of Daggers","PHB'24","251","2nd","Action","Concentration, up to 1 minute","Conjuration","60 feet","V, S, M (a sliver of glass)","Bard, Sorcerer, Warlock, Wizard","","You conjure spinning daggers in a 5-foot Cube centered on a point within range. Each creature in that area takes 4d4 Slashing damage. A creature also takes this damage if it enters the Cube or ends its turn there or if the Cube moves into its space. A creature takes this damage only once per turn.On your later turns, you can take a Magic action to teleport the Cube up to 30 feet."," Using a Higher-Level Spell Slot. The damage increases by 2d4 for each spell slot level above 2."
"Color Spray","PHB'24","251","1st","Action","Instantaneous","Illusion","Self","V, S, M (a pinch of colorful sand)","Bard, Sorcerer, Wizard","","You launch a dazzling array of flashing, colorful light. Each creature in a 15-foot Cone originating from you must succeed on a Constitution saving throw or have the Blinded condition until the end of your next turn.",""
"Command","PHB'24","251","1st","Action","Instantaneous","Enchantment","60 feet","V","Bard, Cleric, Paladin","","You speak a one-word command to a creature you can see within range. The target must succeed on a Wisdom saving throw or follow the command on its next turn. Choose the command from these options:Approach. The target moves toward you by the shortest and most direct route, ending its turn if it moves within 5 feet of you.Drop. The target drops whatever it is holding and then ends its turn.Flee. The target spends its turn moving away from you by the fastest available means.Grovel. The target has the Prone condition and then ends its turn.Halt. On its turn, the target doesn't move and takes no action or Bonus Action."," Using a Higher-Level Spell Slot. You can affect one additional creature for each spell slot level above 1."
"Comprehend Languages","PHB'24","252","1st","Action","1 hour","Divination (ritual)","Self","V, S, M (a pinch of soot and salt)","Bard, Sorcerer, Warlock, Wizard","","For the duration, you understand the literal meaning of any language that you hear or see signed. You also understand any written language that you see, but you must be touching the surface on which the words are written. It takes about 1 minute to read one page of text. This spell doesn't decode symbols or secret messages.",""
"Compulsion","PHB'24","252","4th","Action","Concentration, up to 1 minute","Enchantment","30 feet","V, S","Bard","","Each creature of your choice that you can see within range must succeed on a Wisdom saving throw or have the Charmed condition until the spell ends.For the duration, you can take a Bonus Action to designate a direction that is horizontal to you. Each Charmed target must use as much of its movement as possible to move in that direction on its next turn, taking the safest route. After moving in this way, a target repeats the save, ending the spell on itself on a success.",""
"Confusion","PHB'24","253","4th","Action","Concentration, up to 1 minute","Enchantment","90 feet","V, S, M (three nut shells)","Bard, Druid, Sorcerer, Wizard","","Each creature in a 10-foot-radius Sphere centered on a point you choose within range must succeed on a Wisdom saving throw, or that target can't take Bonus Actions or Reactions and must roll 1d10 at the start of each of its turns to determine its behavior for that turn, consulting the table below.1d10Behavior for the Turn1The target doesn't take an action, and it uses all its movement to move. Roll 1d4 for the direction: 1, north; 2, east; 3, south; or 4, west.2-6The target doesn't move or take actions.7-8The target doesn't move, and it takes the Attack action to make one melee attack against a random creature within reach. If none are within reach, the target takes no action.9-10The target chooses its behavior.At the end of each of its turns, an affected target repeats the save, ending the spell on itself on a success."," Using a Higher-Level Spell Slot. The Sphere's radius increases by 5 feet for each spell slot level above 4."
"Crown of Madness","PHB'24","259","2nd","Action","Concentration, up to 1 minute","Enchantment","120 feet","V, S","Bard, Sorcerer, Warlock, Wizard","","One creature that you can see within range must succeed on a Wisdom saving throw or have the Charmed condition for the duration. The creature succeeds automatically if it isn't Humanoid.A spectral crown appears on the Charmed target's head, and it must use its action before moving on each of its turns to make a melee attack against a creature other than itself that you mentally choose. The target can act normally on its turn if you choose no creature or if no creature is within its reach. The target repeats the save at the end of each of its turns, ending the spell on itself on a success.On your later turns, you must take the Magic action to maintain control of the target, or the spell ends.",""
"Cure Wounds","PHB'24","259","1st","Action","Instantaneous","Abjuration","Touch","V, S","Artificer, Bard, Cleric, Druid, Paladin, Ranger","","A creature you touch regains a number of Hit Points equal to 2d8 plus your spellcasting ability modifier."," Using a Higher-Level Spell Slot. The healing increases by 2d8 for each spell slot level above 1."
"Dancing Lights","PHB'24","259","Cantrip","Action","Concentration, up to 1 minute","Illusion","120 feet","V, S, M (a bit of phosphorus)","Artificer, Bard, Sorcerer, Wizard","","You create up to four torch-size lights within range, making them appear as torches, lanterns, or glowing orbs that hover for the duration. Alternatively, you combine the four lights into one glowing Medium form that is vaguely humanlike. Whichever form you choose, each light sheds Dim Light in a 10-foot radius.As a Bonus Action, you can move the lights up to 60 feet to a space within range. A light must be within 20 feet of another light created by this spell, and a light vanishes if it exceeds the spell's range.",""
"Detect Magic","PHB'24","262","1st","Action","Concentration, up to 10 minutes","Divination (ritual)","Self","V, S","Artificer, Bard, Cleric, Druid, Paladin, Ranger, Sorcerer, Warlock, Wizard","","For the duration, you sense the presence of magical effects within 30 feet of yourself. If you sense such effects, you can take the Magic action to see a faint aura around any visible creature or object in the area that bears the magic, and if an effect was created by a spell, you learn the spell's school of magic.The spell is blocked by 1 foot of stone, dirt, or wood; 1 inch of metal; or a thin sheet of lead.",""
"Detect Thoughts","PHB'24","262","2nd","Action","Concentration, up to 1 minute","Divination","Self","V, S, M (1 Copper Piece)","Bard, Sorcerer, Wizard","","You activate one of the effects below. Until the spell ends, you can activate either effect as a Magic action on your later turns. Sense Thoughts. You sense the presence of thoughts within 30 feet of yourself that belong to creatures that know languages or are telepathic. You don't read the thoughts, but you know that a thinking creature is present.The spell is blocked by 1 foot of stone, dirt, or wood; 1 inch of metal; or a thin sheet of lead. Read Thoughts. Target one creature you can see within 30 feet of yourself or one creature within 30 feet of yourself that you detected with the Sense Thoughts option. You learn what is most on the target's mind right now. If the target doesn't know any languages and isn't telepathic, you learn nothing.As a Magic action on your next turn, you can try to probe deeper into the target's mind. If you probe deeper, the target makes a Wisdom saving throw. On a failed save, you discern the target's reasoning, emotions, and something that looms large in its mind (such as a worry, love, or hate). On a successful save, the spell ends. Either way, the target knows that you are probing into its mind, and until you shift your attention away from the target's mind, the target can take an action on its turn to make an Intelligence (Arcana) check against your spell save DC, ending the spell on a success.",""
"Dimension Door","PHB'24","262","4th","Action","Instantaneous","Conjuration","500 feet","V","Bard, Sorcerer, Warlock, Wizard","","You teleport to a location within range. You arrive at exactly the spot desired. It can be a place you can see, one you can visualize, or one you can describe by stating distance and direction, such as ""200 feet straight downward"" or ""300 feet upward to the northwest at a 45-degree angle.""You can also teleport one willing creature. The creature must be within 5 feet of you when you teleport, and it teleports to a space within 5 feet of your destination space.If you, the other creature, or both would arrive in a space occupied by a creature or completely filled by one or more objects, you and any creature traveling with you each take 4d6 Force damage, and the teleportation fails.",""
"Disguise Self","PHB'24","262","1st","Action","1 hour","Illusion","Self","V, S","Artificer, Bard, Sorcerer, Wizard","","You make yourself—including your clothing, armor, weapons, and other belongings on your person—look different until the spell ends. You can seem 1 foot shorter or taller and can appear heavier or lighter. You must adopt a form that has the same basic arrangement of limbs as you have. Otherwise, the extent of the illusion is up to you.The changes wrought by this spell fail to hold up to physical inspection. For example, if you use this spell to add a hat to your outfit, objects pass through the hat, and anyone who touches it would feel nothing.To discern that you are disguised, a creature must take the Study action to inspect your appearance and succeed on an Intelligence (Investigation) check against your spell save DC.",""
"Dispel Magic","PHB'24","264","3rd","Action","Instantaneous","Abjuration","120 feet","V, S","Artificer, Bard, Cleric, Druid, Paladin, Ranger, Sorcerer, Warlock, Wizard","","Choose one creature, object, or magical effect within range. Any ongoing spell of level 3 or lower on the target ends. For each ongoing spell of level 4 or higher on the target, make an ability check using your spellcasting ability (DC 10 plus that spell's level). On a successful check, the spell ends."," Using a Higher-Level Spell Slot. You automatically end a spell on the target if the spell's level is equal to or less than the level of the spell slot you use."
"Dissonant Whispers","PHB'24","264","1st","Action","Instantaneous","Enchantment","60 feet","V","Bard","","One creature of your choice that you can see within range hears a discordant melody in its mind. The target makes a Wisdom saving throw. On a failed save, it takes 3d6 Psychic damage and must immediately use its Reaction, if available, to move as far away from you as it can, using the safest route. On a successful save, the target takes half as much damage only."," Using a Higher-Level Spell Slot. The damage increases by 1d6 for each spell slot level above 1."
