"Name","Source","Page","Level","Casting Time","Duration","School","Range","Components","Classes","Optional/Variant Classes","Text","At Higher Levels"
"Control Water","PHB'24","256","4th","Action","Concentration, up to 10 minutes","Transmutation","300 feet","V, S, M (a mixture of water and dust)","Cleric, Druid, Wizard","","Until the spell ends, you control any water inside an area you choose that is a Cube up to 100 feet on a side, using one of the following effects. As a Magic action on your later turns, you can repeat the same effect or choose a different one. Flood. You cause the water level of all standing water in the area to rise by as much as 20 feet. If you choose an area in a large body of water, you instead create a 20-foot tall wave that travels from one side of the area to the other and then crashes. Any Huge or smaller vehicles in the wave's path are carried with it to the other side. Any Huge or smaller vehicles struck by the wave have a 25 percent chance of capsizing.The water level remains elevated until the spell ends or you choose a different effect. If this effect produced a wave, the wave repeats on the start of your next turn while the flood effect lasts. Part Water. You part water in the area and create a trench. The trench extends across the spell's area, and the separated water forms a wall to either side. The trench remains until the spell ends or you choose a different effect. The water then slowly fills in the trench over the course of the next round until the normal water level is restored. Redirect Flow. You cause flowing water in the area to move in a direction you choose, even if the water has to flow over obstacles, up walls, or in other unlikely directions. The water in the area moves as you direct it, but once it moves beyond the spell's area, it resumes its flow based on the terrain. The water continues to move in the direction you chose until the spell ends or you choose a different effect. Whirlpool. You cause a whirlpool to form in the center of the area, which must be at least 50 feet square and 25 feet deep. The whirlpool lasts until you choose a different effect or the spell ends. The whirlpool is 5 feet wide at the base, up to 50 feet wide at the top, and 25 feet tall. Any creature in the water and within 25 feet of the whirlpool is pulled 10 feet toward it. When a creature enters the whirlpool for the first time on a turn or ends its turn there, it makes a Strength saving throw. On a failed save, the creature takes 2d8 Bludgeoning damage. On a successful save, the creature takes half as much damage. A creature can swim away from the whirlpool only if it first takes an action to pull away and succeeds on a Strength (Athletics) check against your spell save DC.",""
"Control Weather","PHB'24","257","8th","10 Min.","Concentration, up to 8 hours","Transmutation","Self","V, S, M (burning incense)","Cleric, Druid, Wizard","","You take control of the weather within 5 miles of you for the duration. You must be outdoors to cast this spell, and it ends early if you go indoors.When you cast the spell, you change the current weather conditions, which are determined by the DM. You can change precipitation, temperature, and wind. It takes 1d4 × 10 minutes for the new conditions to take effect. Once they do so, you can change the conditions again. When the spell ends, the weather gradually returns to normal.When you change the weather conditions, find a current condition on the following tables and change its stage by one, up or down. When changing the wind, you can change its direction.PrecipitationStageCondition1Clear2Light clouds3Overcast or ground fog4Rain, hail, or snow5Torrential rain, driving hail, or blizzardTemperatureStageCondition1Heat wave2Hot3Warm4Cool5Cold6FreezingWindStageCondition1Calm2Moderate wind3Strong wind4Gale5Storm",""
"Control Winds","XGE","152","5th","Action","Concentration, up to 1 hour","Transmutation","300 feet","V, S","Druid, Druid, Sorcerer, Sorcerer, Wizard, Wizard","","You take control of the air in a 100-foot cube that you can see within range. Choose one of the following effects when you cast the spell. The effect lasts for the spell's duration, unless you use your action on a later turn to switch to a different effect. You can also use your action to temporarily halt the effect or to restart one you've halted. Gusts. A wind picks up within the cube, continually blowing in a horizontal direction you designate. You choose the intensity of the wind: calm, moderate, or strong. If the wind is moderate or strong, ranged weapon attacks that pass through it or that are made against targets within the cube have disadvantage on their attack rolls. If the wind is strong, any creature moving against the wind must spend 1 extra foot of movement for each foot moved. Downdraft. You cause a sustained blast of strong wind to blow downward from the top of the cube. Ranged weapon attacks that pass through the cube or that are made against targets within it have disadvantage on their attack rolls. A creature must make a Strength saving throw if it flies into the cube for the first time on a turn or starts its turn there flying. On a failed save, the creature is knocked prone. Updraft. You cause a sustained updraft within the cube, rising upward from the cube's bottom side. Creatures that end a fall within the cube take only half damage from the fall. When a creature in the cube makes a vertical jump, the creature can jump up to 10 feet higher than normal.",""
"Create Bonfire","XGE","152","Cantrip","Action","Concentration, up to 1 minute","Conjuration","60 feet","V, S","Artificer, Druid, Druid, Sorcerer, Sorcerer, Warlock, Warlock, Wizard, Wizard","","You create a bonfire on ground that you can see within range. Until the spell ends, the magic bonfire fills a 5-foot cube. Any creature in the bonfire's space when you cast the spell must succeed on a Dexterity saving throw or take 1d8 fire damage. A creature must also make the saving throw when it moves into the bonfire's space for the first time on a turn or ends its turn there.The bonfire ignites flammable objects in its area that aren't being worn or carried.The spell's damage increases by 1d8 when you reach 5th level (2d8), 11th level (3d8), and 17th level (4d8).",""
"Create or Destroy Water","PHB'24","258","1st","Action","Instantaneous","Transmutation","30 feet","V, S, M (a mix of water and sand)","Cleric, Druid","","You do one of the following:Create Water. You create up to 10 gallons of clean water within range in an open container. Alternatively, the water falls as rain in a 30-foot Cube within range, extinguishing exposed flames there.Destroy Water. You destroy up to 10 gallons of water in an open container within range. Alternatively, you destroy fog in a 30-foot Cube within range."," Using a Higher-Level Spell Slot. You create or destroy 10 additional gallons of water, or the size of the Cube increases by 5 feet, for each spell slot level above 1."
"Cure Wounds","PHB'24","259","1st","Action","Instantaneous","Abjuration","Touch","V, S","Artificer, Bard, Cleric, Druid, Paladin, Ranger","","A creature you touch regains a number of Hit Points equal to 2d8 plus your spellcasting ability modifier."," Using a Higher-Level Spell Slot. The healing increases by 2d8 for each spell slot level above 1."
"Darkvision","PHB'24","260","2nd","Action","8 hours","Transmutation","Touch","V, S, M (a dried carrot)","Artificer, Druid, Ranger, Sorcerer, Wizard","","For the duration, a willing creature you touch has Darkvision with a range of 150 feet.",""
"Daylight","PHB'24","260","3rd","Action","1 hour","Evocation","60 feet","V, S","Cleric, Druid, Paladin, Ranger, Sorcerer","","For the duration, sunlight spreads from a point within range and fills a 60-foot-radius Sphere. The sunlight's area is Bright Light and sheds Dim Light for an additional 60 feet.Alternatively, you cast the spell on an object that isn't being worn or carried, causing the sunlight to fill a 60-foot Emanation originating from that object. Covering that object with something opaque, such as a bowl or helm, blocks the sunlight.If any of this spell's area overlaps with an area of Darkness created by a spell of level 3 or lower, that other spell is dispelled.",""
"Detect Magic","PHB'24","262","1st","Action","Concentration, up to 10 minutes","Divination (ritual)","Self","V, S","Artificer, Bard, Cleric, Druid, Paladin, Ranger, Sorcerer, Warlock, Wizard","","For the duration, you sense the presence of magical effects within 30 feet of yourself. If you sense such effects, you can take the Magic action to see a faint aura around any visible creature or object in the area that bears the magic, and if an effect was created by a spell, you learn the spell's school of magic.The spell is blocked by 1 foot of stone, dirt, or wood; 1 inch of metal; or a thin sheet of lead.",""
"Detect Poison and Disease","PHB'24","262","1st","Action","Concentration, up to 10 minutes","Divination (ritual)","Self","V, S, M (a yew leaf)","Cleric, Druid, Paladin, Ranger","","For the duration, you sense the location of poisons, poisonous or venomous creatures, and magical contagions within 30 feet of yourself. You sense the kind of poison, creature, or contagion in each case.The spell is blocked by 1 foot of stone, dirt, or wood; 1 inch of metal; or a thin sheet of lead.",""
"Dispel Magic","PHB'24","264","3rd","Action","Instantaneous","Abjuration","120 feet","V, S","Artificer, Bard, Cleric, Druid, Paladin, Ranger, Sorcerer, Warlock, Wizard","","Choose one creature, object, or magical effect within range. Any ongoing spell of level 3 or lower on the target ends. For each ongoing spell of level 4 or higher on the target, make an ability check using your spellcasting ability (DC 10 plus that spell's level). On a successful check, the spell ends."," Using a Higher-Level Spell Slot. You automatically end a spell on the target if the spell's level is equal to or less than the level of the spell slot you use."
"Divination","PHB'24","264","4th","Action","Instantaneous","Divination (ritual)","Self","V, S, M (incense worth 25+ GP, which the spell consumes)","Cleric, Druid, Wizard","","This spell puts you in contact with a god or a god's servants. You ask one question about a specific goal, event, or activity to occur within 7 days. The DM offers a truthful reply, which might be a short phrase or cryptic rhyme. The spell doesn't account for circumstances that might change the answer, such as the casting of other spells.If you cast the spell more than once before finishing a Long Rest, there is a cumulative 25 percent chance for each casting after the first that you get no answer.",""
"Dominate Beast","PHB'24","265","4th","Action","Concentration, up to 1 minute","Enchantment","60 feet","V, S","Druid, Ranger, Sorcerer","","One Beast you can see within range must succeed on a Wisdom saving throw or have the Charmed condition for the duration. The target has Advantage on the save if you or your allies are fighting it. Whenever the target takes damage, it repeats the save, ending the spell on itself on a success.You have a telepathic link with the Charmed target while the two of you are on the same plane of existence. On your turn, you can use this link to issue commands to the target (no action required), such as ""Attack that creature,"" ""Move over there,"" or ""Fetch that object."" The target does its best to obey on its turn. If it completes an order and doesn't receive further direction from you, it acts and moves as it likes, focusing on protecting itself.You can command the target to take a Reaction but must take your own Reaction to do so."," Using a Higher-Level Spell Slot. Your Concentration can last longer with a spell slot of level 5 (up to 10 minutes), 6 (up to 1 hour), or 7+ (up to 8 hours)."
"Draconic Transformation","FTD","19","7th","Bonus","Concentration, up to 1 minute","Transmutation","Self","V, S, M (a statuette of a dragon, worth at least 500 gp)","Druid, Druid, Sorcerer, Sorcerer, Wizard, Wizard","","With a roar, you draw on the magic of dragons to transform yourself, taking on draconic features. You gain the following benefits until the spell ends:Blindsight. You have blindsight with a range of 30 feet. Within that range, you can effectively see anything that isn't behind total cover, even if you're blinded or in darkness. Moreover, you can see an invisible creature, unless the creature successfully hides from you.Breath Weapon. When you cast this spell, and as a bonus action on subsequent turns for the duration, you can exhale shimmering energy in a 60-foot cone. Each creature in that area must make a Dexterity saving throw, taking 6d8 force damage on a failed save, or half as much damage on a successful one.Wings. Incorporeal wings sprout from your back, giving you a flying speed of 60 feet.",""
"Druid Grove","XGE","154","6th","10 Min.","24 hours","Abjuration","Touch","V, S, M (mistletoe, which the spell consumes, that was harvested with a golden sickle under the light of a full moon)","Druid, Druid","","You invoke the spirits of nature to protect an area outdoors or underground. The area can be as small as a 30-foot cube or as large as a 90-foot cube. Buildings and other structures are excluded from the affected area. If you cast this spell in the same area every day for a year, the spell lasts until dispelled.The spell creates the following effects within the area. When you cast this spell, you can specify creatures as friends who are immune to the effects. You can also specify a password that, when spoken aloud, makes the speaker immune to these effects.The entire warded area radiates magic. A dispel magic cast on the area, if successful, removes only one of the following effects, not the entire area. That spell's caster chooses which effect to end. Only when all its effects are gone is this spell dispelled. Solid Fog. You can fill any number of 5-foot squares on the ground with thick fog, making them heavily obscured. The fog reaches 10 feet high. In addition, every foot of movement through the fog costs 2 extra feet. To a creature immune to this effect, the fog obscures nothing and looks like soft mist, with motes of green light floating in the air. Grasping Undergrowth. You can fill any number of 5-foot squares on the ground that aren't filled with fog with grasping weeds and vines, as if they were affected by an entangle spell. To a creature immune to this effect, the weeds and vines feel soft and reshape themselves to serve as temporary seats or beds. Grove Guardians. You can animate up to four trees in the area, causing them to uproot themselves from the ground. These trees have the same statistics as an awakened tree, which appears in the Monster Manual, except they can't speak, and their bark is covered with druidic symbols. If any creature not immune to this effect enters the warded area, the grove guardians fight until they have driven off or slain the intruders. The grove guardians also obey your spoken commands (no action required by you) that you issue while in the area. If you don't give them commands and no intruders are present, the grove guardians do nothing. The grove guardians can't leave the warded area. When the spell ends, the magic animating them disappears, and the trees take root again if possible. Additional Spell Effect. You can place your choice of one of the following magical effects within the warded area:A constant gust of wind in two locations of your choiceSpike growth in one location of your choiceWind wall in two locations of your choiceTo a creature immune to this effect, the winds are a fragrant, gentle breeze, and the area of spike growth is harmless.",""
"Druidcraft","PHB'24","266","Cantrip","Action","Instantaneous","Transmutation","30 feet","V, S","Druid","","Whispering to the spirits of nature, you create one of the following effects within range. Weather Sensor. You create a Tiny, harmless sensory effect that predicts what the weather will be at your location for the next 24 hours. The effect might manifest as a golden orb for clear skies, a cloud for rain, falling snowflakes for snow, and so on. This effect persists for 1 round. Bloom. You instantly make a flower blossom, a seed pod open, or a leaf bud bloom. Sensory Effect. You create a harmless sensory effect, such as falling leaves, spectral dancing fairies, a gentle breeze, the sound of an animal, or the faint odor of skunk. The effect must fit in a 5-foot Cube. Fire Play. You light or snuff out a candle, a torch, or a campfire.",""
"Dust Devil","XGE","154","2nd","Action","Concentration, up to 1 minute","Conjuration","60 feet","V, S, M (a pinch of dust)","Druid, Druid, Sorcerer, Sorcerer, Wizard, Wizard","","Choose an unoccupied 5-foot cube of air that you can see within range. An elemental force that resembles a dust devil appears in the cube and lasts for the spell's duration.Any creature that ends its turn within 5 feet of the dust devil must make a Strength saving throw. On a failed save, the creature takes 1d8 bludgeoning damage and is pushed 10 feet away from the dust devil. On a successful save, the creature takes half as much damage and isn't pushed.As a bonus action, you can move the dust devil up to 30 feet in any direction. If the dust devil moves over sand, dust, loose dirt, or light gravel, it sucks up the material and forms a 10-foot-radius cloud of debris around itself that lasts until the start of your next turn. The cloud heavily obscures its area."," At Higher Levels. When you cast this spell using a spell slot of 3rd level or higher, the damage increases by 1d8 for each slot level above 2nd."
"Earth Tremor","XGE","155","1st","Action","Instantaneous","Evocation","10 feet","V, S","Bard, Bard, Druid, Druid, Sorcerer, Sorcerer, Wizard, Wizard","","You cause a tremor in the ground within range. Each creature other than you in that area must make a Dexterity saving throw. On a failed save, a creature takes 1d6 bludgeoning damage and is knocked prone. If the ground in that area is loose earth or stone, it becomes difficult terrain until cleared, with each 5-foot-diameter portion requiring at least 1 minute to clear by hand."," At Higher Levels. When you cast this spell using a spell slot of 2nd level or higher, the damage increases by 1d6 for each slot level above 1st."
"Earthbind","XGE","154","2nd","Action","Concentration, up to 1 minute","Transmutation","300 feet","V","Druid, Druid, Sorcerer, Sorcerer, Warlock, Warlock, Wizard, Wizard","","Choose one creature you can see within range. Yellow strips of magical energy loop around the creature. The target must succeed on a Strength saving throw, or its flying speed (if any) is reduced to 0 feet for the spell's duration. An airborne creature affected by this spell safely descends at 60 feet per round until it reaches the ground or the spell ends.",""
"Earthquake","PHB'24","267","8th","Action","Concentration, up to 1 minute","Transmutation","500 feet","V, S, M (a fractured rock)","Cleric, Druid, Sorcerer","","Choose a point on the ground that you can see within range. For the duration, an intense tremor rips through the ground in a 100-foot-radius circle centered on that point. The ground there is Difficult Terrain.When you cast this spell and at the end of each of your turns for the duration, each creature on the ground in the area makes a Dexterity saving throw. On a failed save, a creature has the Prone condition, and its Concentration is broken.You can also cause the effects below. Fissures. A total of 1d6 fissures open in the spell's area at the end of the turn you cast it. You choose the fissures' locations, which can't be under structures. Each fissure is 1d10 × 10 feet deep and 10 feet wide, and it extends from one edge of the spell's area to another edge. A creature in the same space as a fissure must succeed on a Dexterity saving throw or fall in. A creature that successfully saves moves with the fissure's edge as it opens. Structures. The tremor deals 50 Bludgeoning damage to any structure in contact with the ground in the area when you cast the spell and at the end of each of your turns until the spell ends. If a structure drops to 0 Hit Points, it collapses.A creature within a distance from a collapsing structure equal to half the structure's height makes a Dexterity saving throw. On a failed save, the creature takes 12d6 Bludgeoning damage, has the Prone condition, and is buried in the rubble, requiring a DC 20 Strength (Athletics) check as an action to escape. On a successful save, the creature takes half as much damage only.",""
"Elemental Bane","XGE","155","4th","Action","Concentration, up to 1 minute","Transmutation","90 feet","V, S","Artificer, Druid, Druid, Warlock, Warlock, Wizard, Wizard","","Choose one creature you can see within range, and choose one of the following damage types: acid, cold, fire, lightning, or thunder. The target must succeed on a Constitution saving throw or be affected by the spell for its duration. The first time each turn the affected target takes damage of the chosen type, the target takes an extra 2d6 damage of that type. Moreover, the target loses any resistance to that damage type until the spell ends."," At Higher Levels. When you cast this spell using a spell slot of 5th level or higher, you can target one additional creature for each slot level above 4th. The creatures must be within 30 feet of each other when you target them."
"Elemental Weapon","PHB'24","267","3rd","Action","Concentration, up to 1 hour","Transmutation","Touch","V, S","Artificer, Druid, Paladin, Ranger","","A nonmagical weapon you touch becomes a magic weapon. Choose one of the following damage types: Acid, Cold, Fire, Lightning, or Thunder. For the duration, the weapon has a +1 bonus to attack rolls and deals an extra 1d4 damage of the chosen type when it hits."," Using a Higher-Level Spell Slot. If you use a level 5-6 spell slot, the bonus to attack rolls increases to +2, and the extra damage increases to 2d4. If you use a level 7+ spell slot, the bonus increases to +3, and the extra damage increases to 3d4."
"Elementalism","PHB'24","267","Cantrip","Action","Instantaneous","Transmutation","30 feet","V, S","Druid, Sorcerer, Wizard","","You exert control over the elements, creating one of the following effects within range. Beckon Air. You create a breeze strong enough to ripple cloth, stir dust, rustle leaves, and close open doors and shutters, all in a 5-foot Cube. Doors and shutters being held open by someone or something aren't affected. Beckon Earth. You create a thin shroud of dust or sand that covers surfaces in a 5-foot-square area, or you cause a single word to appear in your handwriting in a patch of dirt or sand. Beckon Fire. You create a thin cloud of harmless embers and colored, scented smoke in a 5-foot Cube. You choose the color and scent, and the embers can light candles, torches, or lamps in that area. The smoke's scent lingers for 1 minute. Beckon Water. You create a spray of cool mist that lightly dampens creatures and objects in a 5-foot Cube. Alternatively, you create 1 cup of clean water either in an open container or on a surface, and the water evaporates in 1 minute. Sculpt Element. You cause dirt, sand, fire, smoke, mist, or water that can fit in a 1-foot Cube to assume a crude shape (such as that of a creature) for 1 hour.",""
"Enhance Ability","PHB'24","268","2nd","Action","Concentration, up to 1 hour","Transmutation","Touch","V, S, M (fur or a feather)","Artificer, Bard, Cleric, Druid, Ranger, Sorcerer, Wizard","","You touch a creature and choose Strength, Dexterity, Intelligence, Wisdom, or Charisma. For the duration, the target has Advantage on ability checks using the chosen ability."," Using a Higher-Level Spell Slot. You can target one additional creature for each spell slot level above 2. You can choose a different ability for each target."
"Enlarge/Reduce","PHB'24","268","2nd","Action","Concentration, up to 1 minute","Transmutation","30 feet","V, S, M (a pinch of powdered iron)","Artificer, Bard, Druid, Sorcerer, Wizard","","For the duration, the spell enlarges or reduces a creature or an object you can see within range (see the chosen effect below). A targeted object must be neither worn nor carried. If the target is an unwilling creature, it can make a Constitution saving throw. On a successful save, the spell has no effect.Everything that a targeted creature is wearing and carrying changes size with it. Any item it drops returns to normal size at once. A thrown weapon or piece of ammunition returns to normal size immediately after it hits or misses a target. Enlarge. The target's size increases by one category—from Medium to Large, for example. The target also has Advantage on Strength checks and Strength saving throws. The target's attacks with its enlarged weapons or Unarmed Strikes deal an extra 1d4 damage on a hit. Reduce. The target's size decreases by one category—from Medium to Small, for example. The target also has Disadvantage on Strength checks and Strength saving throws. The target's attacks with its reduced weapons or Unarmed Strikes deal 1d4 less damage on a hit (this can't reduce the damage below 1).",""
"Entangle","PHB'24","268","1st","Action","Concentration, up to 1 minute","Conjuration","90 feet","V, S","Druid, Ranger","","Grasping plants sprout from the ground in a 20-foot square within range. For the duration, these plants turn the ground in the area into Difficult Terrain. They disappear when the spell ends.Each creature (other than you) in the area when you cast the spell must succeed on a Strength saving throw or have the Restrained condition until the spell ends. A Restrained creature can take an action to make a Strength (Athletics) check against your spell save DC. On a success, it frees itself from the grasping plants and is no longer Restrained by them.",""
