"Name","Source","Page","Level","Casting Time","Duration","School","Range","Components","Classes","Optional/Variant Classes","Text","At Higher Levels"
"Absorb Elements","XGE","150","1st","Reaction","1 round","Abjuration","Self","S","Artificer, Druid, Druid, Ranger, Ranger, Sorcerer, Sorcerer, Wizard, Wizard","","The spell captures some of the incoming energy, lessening its effect on you and storing it for your next melee attack. You have resistance to the triggering damage type until the start of your next turn. Also, the first time you hit with a melee attack on your next turn, the target takes an extra 1d6 damage of the triggering type, and the spell ends."," At Higher Levels. When you cast this spell using a spell slot of 2nd level or higher, the extra damage increases by 1d6 for each slot level above 1st."
"Aid","PHB'24","239","2nd","Action","8 hours","Abjuration","30 feet","V, S, M (a strip of white cloth)","Artificer, Bard, Cleric, Druid, Paladin, Ranger","","Choose up to three creatures within range. Each target's Hit Point maximum and current Hit Points increase by 5 for the duration."," Using a Higher-Level Spell Slot. Each target's Hit Points increase by 5 for each spell slot level above 2."
"Air Bubble","AAG","22","2nd","Action","24 hours","Conjuration","60 feet","S","Artificer, Druid, Druid, Ranger, Ranger, Sorcerer, Sorcerer, Wizard, Wizard","","You create a spectral globe around the head of a willing creature you can see within range. The globe is filled with fresh air that lasts until the spell ends. If the creature has more than one head, the globe of air appears around only one of its heads (which is all the creature needs to avoid suffocation, assuming that all its heads share the same respiratory system)."," At Higher Levels. When you cast this spell using a spell slot of 3rd level or higher, you can create two additional globes of fresh air for each slot level above 2nd."
"Animal Friendship","PHB'24","239","1st","Action","24 hours","Enchantment","30 feet","V, S, M (a morsel of food)","Bard, Druid, Ranger","","Target a Beast that you can see within range. The target must succeed on a Wisdom saving throw or have the Charmed condition for the duration. If you or one of your allies deals damage to the target, the spells ends."," Using a Higher-Level Spell Slot. You can target one additional Beast for each spell slot level above 1."
"Animal Messenger","PHB'24","240","2nd","Action","24 hours","Enchantment (ritual)","30 feet","V, S, M (a morsel of food)","Bard, Druid, Ranger","","A Tiny Beast of your choice that you can see within range must succeed on a Charisma saving throw, or it attempts to deliver a message for you (if the target's Challenge Rating isn't 0, it automatically succeeds). You specify a location you have visited and a recipient who matches a general description, such as ""a person dressed in the uniform of the town guard"" or ""a red-haired dwarf wearing a pointed hat."" You also communicate a message of up to twenty-five words. The Beast travels for the duration toward the specified location, covering about 25 miles per 24 hours or 50 miles if the Beast can fly.When the Beast arrives, it delivers your message to the creature that you described, mimicking your communication. If the Beast doesn't reach its destination before the spell ends, the message is lost, and the Beast returns to where you cast the spell."," Using a Higher-Level Spell Slot. The spell's duration increases by 48 hours for each spell slot level above 2."
"Animal Shapes","PHB'24","240","8th","Action","24 hours","Transmutation","30 feet","V, S","Druid","","Choose any number of willing creatures that you can see within range. Each target shape-shifts into a Large or smaller Beast of your choice that has a Challenge Rating of 4 or lower. You can choose a different form for each target. On later turns, you can take a Magic action to transform the targets again.A target's game statistics are replaced by the chosen Beast's statistics, but the target retains its creature type; Hit Points; Hit Point Dice; alignment; ability to communicate; and Intelligence, Wisdom, and Charisma scores. The target's actions are limited by the Beast form's anatomy, and it can't cast spells. The target's equipment melds into the new form, and the target can't use any of that equipment while in that form.The target gains a number of Temporary Hit Points equal to the Hit Points of the first form into which it shape-shifts. These Temporary Hit Points vanish if any remain when the spell ends. The transformation lasts for the duration or until the target ends it as a Bonus Action.",""
"Antilife Shell","PHB'24","241","5th","Action","Concentration, up to 1 hour","Abjuration","Self","V, S","Druid","","An aura extends from you in a 10-foot Emanation for the duration. The aura prevents creatures other than Constructs and Undead from passing or reaching through it. An affected creature can cast spells or make attacks with Ranged or Reach weapons through the barrier.If you move so that an affected creature is forced to pass through the barrier, the spell ends.",""
"Antipathy/Sympathy","PHB'24","242","8th","1 Hr.","10 days","Enchantment","60 feet","V, S, M (a mix of vinegar and honey)","Bard, Druid, Wizard","","As you cast the spell, choose whether it creates antipathy or sympathy, and target one creature or object that is Huge or smaller. Then specify a kind of creature, such as red dragons, goblins, or vampires. A creature of the chosen kind makes a Wisdom saving throw when it comes within 120 feet of the target. Your choice of antipathy or sympathy determines what happens to a creature when it fails that save:Antipathy. The creature has the Frightened condition. The Frightened creature must use its movement on its turns to get as far away as possible from the target, moving by the safest route.Sympathy. The creature has the Charmed condition. The Charmed creature must use its movement on its turns to get as close as possible to the target, moving by the safest route. If the creature is within 5 feet of the target, the creature can't willingly move away. If the target damages the Charmed creature, that creature can make a Wisdom saving throw to end the effect, as described below. Ending the Effect. If the Frightened or Charmed creature ends its turn more than 120 feet away from the target, the creature makes a Wisdom saving throw. On a successful save, the creature is no longer affected by the target. A creature that successfully saves against this effect is immune to it for 1 minute, after which it can be affected again.",""
"Augury","PHB'24","244","2nd","1 Min.","Instantaneous","Divination (ritual)","Self","V, S, M (specially marked sticks, bones, cards, or other divinatory tokens worth 25+ GP)","Cleric, Druid, Wizard","","You receive an omen from an otherworldly entity about the results of a course of action that you plan to take within the next 30 minutes. The DM chooses the omen from the Omens table.OmensOmenFor Results That Will Be...WealGoodWoeBadWeal and woeGood and badIndifferenceNeither good nor badThe spell doesn't account for circumstances, such as other spells, that might change the results.If you cast the spell more than once before finishing a Long Rest, there is a cumulative 25 percent chance for each casting after the first that you get no answer.",""
"Aura of Vitality","PHB'24","244","3rd","Action","Concentration, up to 1 minute","Abjuration","Self","V","Cleric, Druid, Paladin","","An aura radiates from you in a 30-foot Emanation for the duration. When you create the aura and at the start of each of your turns while it persists, you can restore 2d6 Hit Points to one creature in it.",""
"Awaken","PHB'24","244","5th","8 Hr.","Instantaneous","Transmutation","Touch","V, S, M (an agate worth 1,000+ GP, which the spell consumes)","Bard, Druid","","You spend the casting time tracing magical pathways within a precious gemstone, and then touch the target. The target must be either a Beast or Plant creature with an Intelligence of 3 or less or a natural plant that isn't a creature. The target gains an Intelligence of 10 and the ability to speak one language you know. If the target is a natural plant, it becomes a Plant creature and gains the ability to move its limbs, roots, vines, creepers, and so forth, and it gains senses similar to a human's. The DM chooses statistics appropriate for the awakened Plant, such as the statistics for the Awakened Shrub or Awakened Tree in the Monster Manual.The awakened target has the Charmed condition for 30 days or until you or your allies deal damage to it. When that condition ends, the awakened creature chooses its attitude toward you.",""
"Barkskin","PHB'24","245","2nd","Bonus","1 hour","Transmutation","Touch","V, S, M (a handful of oak bark)","Druid, Ranger","","You touch a willing creature. Until the spell ends, the target's skin assumes a bark-like appearance, and the target has an Armor Class of 17 if its AC is lower than that.",""
"Beast Bond","XGE","150","1st","Action","Concentration, up to 10 minutes","Divination","Touch","V, S, M (a bit of fur wrapped in a cloth)","Druid, Druid, Ranger, Ranger","","You establish a telepathic link with one beast you touch that is friendly to you or charmed by you. The spell fails if the beast's Intelligence score is 4 or higher. Until the spell ends, the link is active while you and the beast are within line of sight of each other. Through the link, the beast can understand your telepathic messages to it, and it can telepathically communicate simple emotions and concepts back to you. While the link is active, the beast gains advantage on attack rolls against any creature within 5 feet of you that you can see.",""
"Beast Sense","PHB'24","245","2nd","Action","Concentration, up to 1 hour","Divination (ritual)","Touch","S","Druid, Ranger","","You touch a willing Beast. For the duration, you can perceive through the Beast's senses as well as your own. When perceiving through the Beast's senses, you benefit from any special senses it has.",""
"Befuddlement","PHB'24","245","8th","Action","Instantaneous","Enchantment","150 feet","V, S, M (a key ring with no keys)","Bard, Druid, Warlock, Wizard","","You blast the mind of a creature that you can see within range. The target makes an Intelligence saving throw.On a failed save, the target takes 10d12 Psychic damage and can't cast spells or take the Magic action. At the end of every 30 days, the target repeats the save, ending the effect on a success. The effect can also be ended by the Greater Restoration, Heal, or Wish spell.On a successful save, the target takes half as much damage only.",""
"Blight","PHB'24","247","4th","Action","Instantaneous","Necromancy","30 feet","V, S","Druid, Sorcerer, Warlock, Wizard","","A creature that you can see within range makes a Constitution saving throw, taking 8d8 Necrotic damage on a failed save or half as much damage on a successful one. A Plant creature automatically fails the save.Alternatively, target a nonmagical plant that isn't a creature, such as a tree or shrub. It doesn't make a save; it simply withers and dies."," Using a Higher-Level Spell Slot. The damage increases by 1d8 for each spell slot level above 4."
"Bones of the Earth","XGE","150","6th","Action","Instantaneous","Transmutation","120 feet","V, S","Druid, Druid","","You cause up to six pillars of stone to burst from places on the ground that you can see within range. Each pillar is a cylinder that has a diameter of 5 feet and a height of up to 30 feet. The ground where a pillar appears must be wide enough for its diameter, and you can target the ground under a creature if that creature is Medium or smaller. Each pillar has AC 5 and 30 hit points. When reduced to 0 hit points, a pillar crumbles into rubble, which creates an area of difficult terrain with a 10-foot radius that lasts until the rubble is cleared. Each 5-foot-diameter portion of the area requires at least 1 minute to clear by hand.If a pillar is created under a creature, that creature must succeed on a Dexterity saving throw or be lifted by the pillar. A creature can choose to fail the save.If a pillar is prevented from reaching its full height because of a ceiling or other obstacle, a creature on the pillar takes 6d6 bludgeoning damage and is restrained, pinched between the pillar and the obstacle. The restrained creature can use an action to make a Strength or Dexterity check (the creature's choice) against the spell's save DC. On a success, the creature is no longer restrained and must either move off the pillar or fall off it."," At Higher Levels. When you cast this spell using a spell slot of 7th level or higher, you can create two additional pillars for each slot level above 6th."
"Call Lightning","PHB'24","248","3rd","Action","Concentration, up to 10 minutes","Conjuration","120 feet","V, S","Druid","","A storm cloud appears at a point within range that you can see above yourself. It takes the shape of a Cylinder that is 10 feet tall with a 60-foot radius.When you cast the spell, choose a point you can see under the cloud. A lightning bolt shoots from the cloud to that point. Each creature within 5 feet of that point makes a Dexterity saving throw, taking 3d10 Lightning damage on a failed save or half as much damage on a successful one.Until the spell ends, you can take a Magic action to call down lightning in that way again, targeting the same point or a different one.If you're outdoors in a storm when you cast this spell, the spell gives you control over that storm instead of creating a new one. Under such conditions, the spell's damage increases by 1d10."," Using a Higher-Level Spell Slot. The damage increases by 1d10 for each spell slot level above 3."
"Charm Monster","PHB'24","249","4th","Action","1 hour","Enchantment","30 feet","V, S","Bard, Druid, Sorcerer, Warlock, Wizard","","One creature you can see within range makes a Wisdom saving throw. It does so with Advantage if you or your allies are fighting it. On a failed save, the target has the Charmed condition until the spell ends or until you or your allies damage it. The Charmed creature is Friendly to you. When the spell ends, the target knows it was Charmed by you."," Using a Higher-Level Spell Slot. You can target one additional creature for each spell slot level above 4."
"Charm Person","PHB'24","249","1st","Action","1 hour","Enchantment","30 feet","V, S","Bard, Druid, Sorcerer, Warlock, Wizard","","One Humanoid you can see within range makes a Wisdom saving throw. It does so with Advantage if you or your allies are fighting it. On a failed save, the target has the Charmed condition until the spell ends or until you or your allies damage it. The Charmed creature is Friendly to you. When the spell ends, the target knows it was Charmed by you."," Using a Higher-Level Spell Slot. You can target one additional creature for each spell slot level above 1."
"Commune with Nature","PHB'24","252","5th","1 Min.","1 minute","Divination (ritual)","Self","V, S","Druid, Ranger","","You commune with nature spirits and gain knowledge of the surrounding area. In the outdoors, the spell gives you knowledge of the area within 3 miles of you. In caves and other natural underground settings, the radius is limited to 300 feet. The spell doesn't function where nature has been replaced by construction, such as in castles and settlements.Choose three of the following facts; you learn those facts as they pertain to the spell's area:Locations of settlementsLocations of portals to other planes of existenceLocation of one Challenge Rating 10+ creature (DM's choice) that is a Celestial, an Elemental, a Fey, a Fiend, or an UndeadThe most prevalent kind of plant, mineral, or Beast (you choose which to learn)Locations of bodies of waterFor example, you could determine the location of a powerful monster in the area, the locations of bodies of water, and the locations of any towns.",""
"Cone of Cold","PHB'24","253","5th","Action","Instantaneous","Evocation","Self","V, S, M (a small crystal or glass cone)","Druid, Sorcerer, Wizard","","You unleash a blast of cold air. Each creature in a 60-foot Cone originating from you makes a Constitution saving throw, taking 8d8 Cold damage on a failed save or half as much damage on a successful one. A creature killed by this spell becomes a frozen statue until it thaws."," Using a Higher-Level Spell Slot. The damage increases by 1d8 for each spell slot level above 5."
"Confusion","PHB'24","253","4th","Action","Concentration, up to 1 minute","Enchantment","90 feet","V, S, M (three nut shells)","Bard, Druid, Sorcerer, Wizard","","Each creature in a 10-foot-radius Sphere centered on a point you choose within range must succeed on a Wisdom saving throw, or that target can't take Bonus Actions or Reactions and must roll 1d10 at the start of each of its turns to determine its behavior for that turn, consulting the table below.1d10Behavior for the Turn1The target doesn't take an action, and it uses all its movement to move. Roll 1d4 for the direction: 1, north; 2, east; 3, south; or 4, west.2-6The target doesn't move or take actions.7-8The target doesn't move, and it takes the Attack action to make one melee attack against a random creature within reach. If none are within reach, the target takes no action.9-10The target chooses its behavior.At the end of each of its turns, an affected target repeats the save, ending the spell on itself on a success."," Using a Higher-Level Spell Slot. The Sphere's radius increases by 5 feet for each spell slot level above 4."
"Conjure Animals","PHB'24","254","3rd","Action","Concentration, up to 10 minutes","Conjuration","60 feet","V, S","Druid, Ranger","","You conjure nature spirits that appear as a Large pack of spectral, intangible animals in an unoccupied space you can see within range. The pack lasts for the duration, and you choose the spirits' animal form, such as wolves, serpents, or birds.You have Advantage on Strength saving throws while you're within 5 feet of the pack, and when you move on your turn, you can also move the pack up to 30 feet to an unoccupied space you can see.Whenever the pack moves within 10 feet of a creature you can see and whenever a creature you can see enters a space within 10 feet of the pack or ends its turn there, you can force that creature to make a Dexterity saving throw. On a failed save, the creature takes 3d10 Slashing damage. A creature makes this save only once per turn."," Using a Higher-Level Spell Slot. The damage increases by 1d10 for each spell slot level above 3."
"Conjure Elemental","PHB'24","254","5th","Action","Concentration, up to 10 minutes","Conjuration","60 feet","V, S","Druid, Wizard","","You conjure a Large, intangible spirit from the Elemental Planes that appears in an unoccupied space within range. Choose the spirit's element, which determines its damage type: air (Lightning), earth (Thunder), fire (Fire), or water (Cold). The spirit lasts for the duration.Whenever a creature you can see enters the spirit's space or starts its turn within 5 feet of the spirit, you can force that creature to make a Dexterity saving throw if the spirit has no creature Restrained. On failed save, the target takes 8d8 damage of the spirit's type, and the target has the Restrained condition until the spell ends. At the start of each of its turns, the Restrained target repeats the save. On a failed save, the target takes 4d8 damage of the spirit's type. On a successful save, the target isn't Restrained by the spirit."," Using a Higher-Level Spell Slot. The damage increases by 1d8 for each spell slot level above 5."
"Conjure Fey","PHB'24","255","6th","Action","Concentration, up to 10 minutes","Conjuration","60 feet","V, S","Druid","","You conjure a Medium spirit from the Feywild in an unoccupied space you can see within range. The spirit lasts for the duration, and it looks like a Fey creature of your choice. When the spirit appears, you can make one melee spell attack against a creature within 5 feet of it. On a hit, the target takes Psychic damage equal to 3d12 plus your spellcasting ability modifier, and the target has the Frightened condition until the start of your next turn, with both you and the spirit as the source of the fear.As a Bonus Action on your later turns, you can teleport the spirit to an unoccupied space you can see within 30 feet of the space it left and make the attack against a creature within 5 feet of it."," Using a Higher-Level Spell Slot. The damage increases by 1d12 for each spell slot level above 6."
"Conjure Minor Elementals","PHB'24","255","4th","Action","Concentration, up to 10 minutes","Conjuration","Self","V, S","Druid, Wizard","","You conjure spirits from the Elemental Planes that flit around you in a 15-foot Emanation for the duration. Until the spell ends, any attack you make deals an extra 2d8 damage when you hit a creature in the Emanation. This damage is Acid, Cold, Fire, or Lightning (your choice when you make the attack).In addition, the ground in the Emanation is Difficult Terrain for your enemies."," Using a Higher-Level Spell Slot. The damage increases by 1d8 for each spell slot level above 4."
"Conjure Woodland Beings","PHB'24","255","4th","Action","Concentration, up to 10 minutes","Conjuration","Self","V, S","Druid, Ranger","","You conjure nature spirits that flit around you in a 10-foot Emanation for the duration. Whenever the Emanation enters the space of a creature you can see and whenever a creature you can see enters the Emanation or ends its turn there, you can force that creature to make a Wisdom saving throw. The creature takes 5d8 Force damage on a failed save or half as much damage on a successful one. A creature makes this save only once per turn.In addition, you can take the Disengage action as a Bonus Action for the spell's duration."," Using a Higher-Level Spell Slot. The damage increases by 1d8 for each spell slot level above 4."
"Contagion","PHB'24","256","5th","Action","7 days","Necromancy","Touch","V, S","Cleric, Druid","","Your touch inflicts a magical contagion. The target must succeed on a Constitution saving throw or take 11d8 Necrotic damage and have the Poisoned condition. Also, choose one ability when you cast the spell. While Poisoned, the target has Disadvantage on saving throws made with the chosen ability.The target must repeat the saving throw at the end of each of its turns until it gets three successes or failures. If the target succeeds on three of these saves, the spell ends on the target. If the target fails three of the saves, the spell lasts for 7 days on it.Whenever the Poisoned target receives an effect that would end the Poisoned condition, the target must succeed on a Constitution saving throw, or the Poisoned condition doesn't end on it.",""
"Continual Flame","PHB'24","256","2nd","Action","Until dispelled","Evocation","Touch","V, S, M (ruby dust worth 50+ GP, which the spell consumes)","Artificer, Cleric, Druid, Wizard","","A flame springs from an object that you touch. The effect casts Bright Light in a 20-foot radius and Dim Light for an additional 20 feet. It looks like a regular flame, but it creates no heat and consumes no fuel. The flame can be covered or hidden but not smothered or quenched.",""
"Control Flames","XGE","152","Cantrip","Action","Instantaneous or 1 hour (see below)","Transmutation","60 feet","S","Druid, Druid, Sorcerer, Sorcerer, Wizard, Wizard","","You choose nonmagical flame that you can see within range and that fits within a 5-foot cube. You affect it in one of the following ways:You instantaneously expand the flame 5 feet in one direction, provided that wood or other fuel is present in the new location.You instantaneously extinguish the flames within the cube.You double or halve the area of bright light and dim light cast by the flame, change its color, or both. The change lasts for 1 hour.You cause simple shapes—such as the vague form of a creature, an inanimate object, or a location—to appear within the flames and animate as you like. The shapes last for 1 hour.If you cast this spell multiple times, you can have up to three non-instantaneous effects created by it active at a time, and you can dismiss such an effect as an action.",""
