"Name","Source","Page","Level","Casting Time","Duration","School","Range","Components","Classes","Optional/Variant Classes","Text","At Higher Levels"
"Resistance","PHB'24","312","Cantrip","Action","Concentration, up to 1 minute","Abjuration","Touch","V, S","Artificer, Cleric, Druid","","You touch a willing creature and choose a damage type: Acid, Bludgeoning, Cold, Fire, Lightning, Necrotic, Piercing, Poison, Radiant, Slashing, or Thunder. When the creature takes damage of the chosen type before the spell ends, the creature reduces the total damage taken by 1d4. A creature can benefit from this spell only once per turn.",""
"Reverse Gravity","PHB'24","312","7th","Action","Concentration, up to 1 minute","Transmutation","100 feet","V, S, M (a lodestone and iron filings)","Druid, Sorcerer, Wizard","","This spell reverses gravity in a 50-foot-radius, 100-foot high Cylinder centered on a point within range. All creatures and objects in that area that aren't anchored to the ground fall upward and reach the top of the Cylinder. A creature can make a Dexterity saving throw to grab a fixed object it can reach, thus avoiding the fall upward.If a ceiling or an anchored object is encountered in this upward fall, creatures and objects strike it just as they would during a downward fall. If an affected creature or object reaches the Cylinder's top without striking anything, it hovers there for the duration. When the spell ends, affected objects and creatures fall downward.",""
"Revivify","PHB'24","312","3rd","Action","Instantaneous","Necromancy","Touch","V, S, M (a diamond worth 300+ GP, which the spell consumes)","Artificer, Cleric, Druid, Paladin, Ranger","","You touch a creature that has died within the last minute. That creature revives with 1 Hit Point. This spell can't revive a creature that has died of old age, nor does it restore any missing body parts.",""
"Scrying","PHB'24","313","5th","10 Min.","Concentration, up to 10 minutes","Divination","Self","V, S, M (a focus worth 1,000+ GP, such as a crystal ball, mirror, or water-filled font)","Bard, Cleric, Druid, Warlock, Wizard","","You can see and hear a creature you choose that is on the same plane of existence as you. The target makes a Wisdom saving throw, which is modified (see the tables below) by how well you know the target and the sort of physical connection you have to it. The target doesn't know what it is making the save against, only that it feels uneasy.Your Knowledge of the Target Is...Save ModifierSecondhand (heard of the target)+5Firsthand (met the target)+0Extensive (know the target well)-5You Have the Target's...Save ModifierPicture or other likeness-2Garment or other possession-4Body part, lock of hair, or bit of nail-10On a successful save, the target isn't affected, and you can't use this spell on it again for 24 hours.On a failed save, the spell creates an Invisible, intangible sensor within 10 feet of the target. You can see and hear through the sensor as if you were there. The sensor moves with the target, remaining within 10 feet of it for the duration. If something can see the sensor, it appears as a luminous orb about the size of your fist.Instead of targeting a creature, you can target a location you have seen. When you do so, the sensor appears at that location and doesn't move.",""
"Shape Water","XGE","164","Cantrip","Action","Instantaneous or 1 hour (see below)","Transmutation","30 feet","S","Druid, Druid, Sorcerer, Sorcerer, Wizard, Wizard","","You choose an area of water that you can see within range and that fits within a 5-foot cube. You manipulate it in one of the following ways:You instantaneously move or otherwise change the flow of the water as you direct, up to 5 feet in any direction. This movement doesn't have enough force to cause damage.You cause the water to form into simple shapes and animate at your direction. This change lasts for 1 hour.You change the water's color or opacity. The water must be changed in the same way throughout. This change lasts for 1 hour.You freeze the water, provided that there are no creatures in it. The water unfreezes in 1 hour.If you cast this spell multiple times, you can have no more than two of its non-instantaneous effects active at a time, and you can dismiss such an effect as an action.",""
"Shapechange","PHB'24","315","9th","Action","Concentration, up to 1 hour","Transmutation","Self","V, S, M (a jade circlet worth 1,500+ GP)","Druid, Wizard","","You shape-shift into another creature for the duration or until you take a Magic action to shape-shift into a different eligible form. The new form must be of a creature that has a Challenge Rating no higher than your level or Challenge Rating. You must have seen the sort of creature before, and it can't be a Construct or an Undead.When you cast the spell, you gain a number of Temporary Hit Points equal to the Hit Points of the first form into which you shape-shift. These Temporary Hit Points vanish if any remain when the spell ends.Your game statistics are replaced by the stat block of the chosen form, but you retain your creature type; alignment; personality; Intelligence, Wisdom, and Charisma scores; Hit Points; Hit Point Dice; proficiencies; and ability to communicate. If you have the Spellcasting feature, you retain it too.Upon shape-shifting, you determine whether your equipment drops to the ground or changes in size and shape to fit the new form while you're in it.",""
"Shillelagh","PHB'24","316","Cantrip","Bonus","1 minute","Transmutation","Touch","V, S, M (mistletoe)","Druid","","A Club or Quarterstaff you are holding is imbued with nature's power. For the duration, you can use your spellcasting ability instead of Strength for the attack and damage rolls of melee attacks using that weapon, and the weapon's damage die becomes a d8. If the attack deals damage, it can be Force damage or the weapon's normal damage type (your choice).The spell ends early if you cast it again or if you let go of the weapon."," Cantrip Upgrade. The damage die changes when you reach levels 5 (d10), 11 (d12), and 17 (2d6)."
"Skywrite","XGE","165","2nd","Action","Concentration, up to 1 hour","Transmutation (ritual)","Sight","V, S","Artificer, Bard, Bard, Druid, Druid, Wizard, Wizard","","You cause up to ten words to form in a part of the sky you can see. The words appear to be made of cloud and remain in place for the spell's duration. The words dissipate when the spell ends. A strong wind can disperse the clouds and end the spell early.",""
"Sleet Storm","PHB'24","317","3rd","Action","Concentration, up to 1 minute","Conjuration","150 feet","V, S, M (a miniature umbrella)","Druid, Sorcerer, Wizard","","Until the spell ends, sleet falls in a 40-foot-tall, 20-foot-radius Cylinder centered on a point you choose within range. The area is Heavily Obscured, and exposed flames in the area are doused.Ground in the Cylinder is Difficult Terrain. When a creature enters the Cylinder for the first time on a turn or starts its turn there, it must succeed on a Dexterity saving throw or have the Prone condition and lose Concentration.",""
"Snare","XGE","165","1st","1 Min.","8 hours","Abjuration","Touch","S, M (25 feet of rope, which the spell consumes)","Artificer, Druid, Druid, Ranger, Ranger, Wizard, Wizard","","As you cast this spell, you use the rope to create a circle with a 5-foot radius on the ground or the floor. When you finish casting, the rope disappears and the circle becomes a magic trap.This trap is nearly invisible, requiring a successful Intelligence (Investigation) check against your spell save DC to be discerned.The trap triggers when a Small, Medium, or Large creature moves onto the ground or the floor in the spell's radius. That creature must succeed on a Dexterity saving throw or be magically hoisted into the air, leaving it hanging upside down 3 feet above the ground or the floor. The creature is restrained there until the spell ends.A restrained creature can make a Dexterity saving throw at the end of each of its turns, ending the effect on itself on a success. Alternatively, the creature or someone else who can reach it can use an action to make an Intelligence (Arcana) check against your spell save DC. On a success, the restrained effect ends.After the trap is triggered, the spell ends when no creature is restrained by it.",""
"Spare the Dying","PHB'24","318","Cantrip","Action","Instantaneous","Necromancy","15 feet","V, S","Artificer, Cleric, Druid","","Choose a creature within range that has 0 Hit Points and isn't dead. The creature becomes Stable."," Cantrip Upgrade. The range doubles when you reach levels 5 (30 feet), 11 (60 feet), and 17 (120 feet)."
"Speak with Animals","PHB'24","318","1st","Action","10 minutes","Divination (ritual)","Self","V, S","Bard, Druid, Ranger, Warlock","","For the duration, you can comprehend and verbally communicate with Beasts, and you can use any of the Influence action's skill options with them.Most Beasts have little to say about topics that don't pertain to survival or companionship, but at minimum, a Beast can give you information about nearby locations and monsters, including whatever it has perceived within the past day.",""
"Speak with Plants","PHB'24","319","3rd","Action","10 minutes","Transmutation","Self","V, S","Bard, Druid, Ranger","","You imbue plants in an immobile 30-foot Emanation with limited sentience and animation, giving them the ability to communicate with you and follow your simple commands. You can question plants about events in the spell's area within the past day, gaining information about creatures that have passed, weather, and other circumstances.You can also turn Difficult Terrain caused by plant growth (such as thickets and undergrowth) into ordinary terrain that lasts for the duration. Or you can turn ordinary terrain where plants are present into Difficult Terrain that lasts for the duration.The spell doesn't enable plants to uproot themselves and move about, but they can move their branches, tendrils, and stalks for you.If a Plant creature is in the area, you can communicate with it as if you shared a common language.",""
"Spike Growth","PHB'24","319","2nd","Action","Concentration, up to 10 minutes","Transmutation","150 feet","V, S, M (seven thorns)","Druid, Ranger","","The ground in a 20-foot-radius Sphere centered on a point within range sprouts hard spikes and thorns. The area becomes Difficult Terrain for the duration. When a creature moves into or within the area, it takes 2d4 Piercing damage for every 5 feet it travels.The transformation of the ground is camouflaged to look natural. Any creature that can't see the area when the spell is cast must take a Search action and succeed on a Wisdom (Perception or Survival) check against your spell save DC to recognize the terrain as hazardous before entering it.",""
"Starry Wisp","PHB'24","320","Cantrip","Action","Instantaneous","Evocation","60 feet","V, S","Bard, Druid","","You launch a mote of light at one creature or object within range. Make a ranged spell attack against the target. On a hit, the target takes 1d8 Radiant damage, and until the end of your next turn, it emits Dim Light in a 10-foot radius and can't benefit from the Invisible condition."," Cantrip Upgrade. The damage increases by 1d8 when you reach levels 5 (2d8), 11 (3d8), and 17 (4d8)."
"Stone Shape","PHB'24","321","4th","Action","Instantaneous","Transmutation","Touch","V, S, M (soft clay)","Artificer, Cleric, Druid, Wizard","","You touch a stone object of Medium size or smaller or a section of stone no more than 5 feet in any dimension and form it into any shape you like. For example, you could shape a large rock into a weapon, statue, or coffer, or you could make a small passage through a wall that is 5 feet thick. You could also shape a stone door or its frame to seal the door shut. The object you create can have up to two hinges and a latch, but finer mechanical detail isn't possible.",""
"Stoneskin","PHB'24","321","4th","Action","Concentration, up to 1 hour","Transmutation","Touch","V, S, M (diamond dust worth 100+ GP, which the spell consumes)","Artificer, Druid, Ranger, Sorcerer, Wizard","","Until the spell ends, one willing creature you touch has Resistance to Bludgeoning, Piercing, and Slashing damage.",""
"Storm of Vengeance","PHB'24","321","9th","Action","Concentration, up to 1 minute","Conjuration","1 mile","V, S","Druid","","A churning storm cloud forms for the duration, centered on a point within range and spreading to a radius of 300 feet. Each creature under the cloud when it appears must succeed on a Constitution saving throw or take 2d6 Thunder damage and have the Deafened condition for the duration.At the start of each of your later turns, the storm produces different effects, as detailed below. Turn 2. Acidic rain falls. Each creature and object under the cloud takes 4d6 Acid damage. Turn 3. You call six bolts of lightning from the cloud to strike six different creatures or objects beneath it. Each target makes a Dexterity saving throw, taking 10d6 Lightning damage on a failed save or half as much damage on a successful one. Turn 4. Hailstones rain down. Each creature under the cloud takes 2d6 Bludgeoning damage. Turns 5-10. Gusts and freezing rain assail the area under the cloud. Each creature there takes 1d6 Cold damage. Until the spell ends, the area is Difficult Terrain and Heavily Obscured, ranged attacks with weapons are impossible there, and strong wind blows through the area.",""
"Summon Beast","PHB'24","322","2nd","Action","Concentration, up to 1 hour","Conjuration","90 feet","V, S, M (a feather, tuft of fur, and fish tail inside a gilded acorn worth 200+ GP)","Druid, Ranger","","You call forth a bestial spirit. It manifests in an unoccupied space that you can see within range and uses the Bestial Spirit stat block. When you cast the spell, choose an environment: Air, Land, or Water. The creature resembles an animal of your choice that is native to the chosen environment, which determines certain details in its stat block. The creature disappears when it drops to 0 Hit Points or when the spell ends.The creature is an ally to you and your allies. In combat, the creature shares your Initiative count, but it takes its turn immediately after yours. It obeys your verbal commands (no action required by you). If you don't issue any, it takes the Dodge action and uses its movement to avoid danger."," Using a Higher-Level Spell Slot. Use the spell slot's level for the spell's level in the stat block."
"Summon Elemental","PHB'24","325","4th","Action","Concentration, up to 1 hour","Conjuration","90 feet","V, S, M (air, a pebble, ash, and water inside a gold-inlaid vial worth 400+ GP)","Druid, Ranger, Wizard","","You call forth an Elemental spirit. It manifests in an unoccupied space that you can see within range and uses the Elemental Spirit stat block. When you cast the spell, choose an element: Air, Earth, Fire, or Water. The creature resembles a bipedal form wreathed in the chosen element, which determines certain details in its stat block. The creature disappears when it drops to 0 Hit Points or when the spell ends.The creature is an ally to you and your allies. In combat, the creature shares your Initiative count, but it takes its turn immediately after yours. It obeys your verbal commands (no action required by you). If you don't issue any, it takes the Dodge action and uses its movement to avoid danger."," Using a Higher-Level Spell Slot. Use the spell slot's level for the spell's level in the stat block."
"Summon Fey","PHB'24","326","3rd","Action","Concentration, up to 1 hour","Conjuration","90 feet","V, S, M (a gilded flower worth 300+ GP)","Druid, Ranger, Warlock, Wizard","","You call forth a Fey spirit. It manifests in an unoccupied space that you can see within range and uses the Fey Spirit stat block. When you cast the spell, choose a mood: Fuming, Mirthful, or Tricksy. The creature resembles a Fey creature of your choice marked by the chosen mood, which determines certain details in its stat block. The creature disappears when it drops to 0 Hit Points or when the spell ends.The creature is an ally to you and your allies. In combat, the creature shares your Initiative count, but it takes its turn immediately after yours. It obeys your verbal commands (no action required by you). If you don't issue any, it takes the Dodge action and uses its movement to avoid danger."," Using a Higher-Level Spell Slot. Use the spell slot's level for the spell's level in the stat block."
"Sunbeam","PHB'24","329","6th","Action","Concentration, up to 1 minute","Evocation","Self","V, S, M (a magnifying glass)","Cleric, Druid, Sorcerer, Wizard","","You launch a sunbeam in a 5-foot-wide, 60-foot-long Line. Each creature in the Line makes a Constitution saving throw. On a failed save, a creature takes 6d8 Radiant damage and has the Blinded condition until the start of your next turn. On a successful save, it takes half as much damage only.Until the spell ends, you can take a Magic action to create a new Line of radiance.For the duration, a mote of brilliant radiance shines above you. It sheds Bright Light in a 30-foot radius and Dim Light for an additional 30 feet. This light is sunlight.",""
"Sunburst","PHB'24","329","8th","Action","Instantaneous","Evocation","150 feet","V, S, M (a piece of sunstone)","Cleric, Druid, Sorcerer, Wizard","","Brilliant sunlight flashes in a 60-foot-radius Sphere centered on a point you choose within range. Each creature in the Sphere makes a Constitution saving throw. On a failed save, a creature takes 12d6 Radiant damage and has the Blinded condition for 1 minute. On a successful save, it takes half as much damage only.A creature Blinded by this spell makes another Constitution saving throw at the end of each of its turns, ending the effect on itself on a success.This spell dispels Darkness in its area that was created by any spell.",""
"Symbol","PHB'24","329","7th","1 Min.","Until dispelled or triggered","Abjuration","Touch","V, S, M (powdered diamond worth 1,000+ GP, which the spell consumes)","Bard, Cleric, Druid, Wizard","","You inscribe a harmful glyph either on a surface (such as a section of floor or wall) or within an object that can be closed (such as a book or chest). The glyph can cover an area no larger than 10 feet in diameter. If you choose an object, it must remain in place; if it is moved more than 10 feet from where you cast this spell, the glyph is broken, and the spell ends without being triggered.The glyph is nearly imperceptible and requires a successful Wisdom (Perception) check against your spell save DC to notice.When you inscribe the glyph, you set its trigger and choose which effect the symbol bears: Death, Discord, Fear, Pain, Sleep, or Stunning. Each one is explained below. Set the Trigger. You decide what triggers the glyph when you cast the spell. For glyphs inscribed on a surface, common triggers include touching or stepping on the glyph, removing another object covering it, or approaching within a certain distance of it. For glyphs inscribed within an object, common triggers include opening that object or seeing the glyph.You can refine the trigger so that only creatures of certain types activate it (for example, the glyph could be set to affect Aberrations). You can also set conditions for creatures that don't trigger the glyph, such as those who say a certain password.Once triggered, the glyph glows, filling a 60-foot-radius Sphere with Dim Light for 10 minutes, after which time the spell ends. Each creature in the Sphere when the glyph activates is targeted by its effect, as is a creature that enters the Sphere for the first time on a turn or ends its turn there. A creature is targeted only once per turn. Death. Each target makes a Constitution saving throw, taking 10d10 Necrotic damage on a failed save or half as much damage on a successful save. Discord. Each target makes a Wisdom saving throw. On a failed save, a target argues with other creatures for 1 minute. During this time, it is incapable of meaningful communication and has Disadvantage on attack rolls and ability checks. Fear. Each target must succeed on a Wisdom saving throw or have the Frightened condition for 1 minute. While Frightened, the target must move at least 30 feet away from the glyph on each of its turns, if able. Pain. Each target must succeed on a Constitution saving throw or have the Incapacitated condition for 1 minute. Sleep. Each target must succeed on a Wisdom saving throw or have the Unconscious condition for 10 minutes. A creature awakens if it takes damage or if someone takes an action to shake it awake. Stunning. Each target must succeed on a Wisdom saving throw or have the Stunned condition for 1 minute.",""
"Thorn Whip","PHB'24","333","Cantrip","Action","Instantaneous","Transmutation","30 feet","V, S, M (the stem of a plant with thorns)","Artificer, Druid","","You create a vine-like whip covered in thorns that lashes out at your command toward a creature in range. Make a melee spell attack against the target. On a hit, the target takes 1d6 Piercing damage, and if it is Large or smaller, you can pull it up to 10 feet closer to you."," Cantrip Upgrade. The damage increases by 1d6 when you reach levels 5 (2d6), 11 (3d6), and 17 (4d6)."
"Thunderclap","PHB'24","333","Cantrip","Action","Instantaneous","Evocation","Self","S","Artificer, Bard, Druid, Sorcerer, Warlock, Wizard","","Each creature in a 5-foot Emanation originating from you must succeed on a Constitution saving throw or take 1d6 Thunder damage. The spell's thunderous sound can be heard up to 100 feet away."," Cantrip Upgrade. The damage increases by 1d6 when you reach levels 5 (2d6), 11 (3d6), and 17 (4d6)."
"Thunderwave","PHB'24","334","1st","Action","Instantaneous","Evocation","Self","V, S","Bard, Druid, Sorcerer, Wizard","","You unleash a wave of thunderous energy. Each creature in a 15-foot Cube originating from you makes a Constitution saving throw. On a failed save, a creature takes 2d8 Thunder damage and is pushed 10 feet away from you. On a successful save, a creature takes half as much damage only.In addition, unsecured objects that are entirely within the Cube are pushed 10 feet away from you, and a thunderous boom is audible within 300 feet."," Using a Higher-Level Spell Slot. The damage increases by 1d8 for each spell slot level above 1."
"Tidal Wave","XGE","168","3rd","Action","Instantaneous","Conjuration","120 feet","V, S, M (a drop of water)","Druid, Druid, Sorcerer, Sorcerer, Wizard, Wizard","","You conjure up a wave of water that crashes down on an area within range. The area can be up to 30 feet long, up to 10 feet wide, and up to 10 feet tall. Each creature in that area must make a Dexterity saving throw. On a failed save, a creature takes 4d8 bludgeoning damage and is knocked prone. On a successful save, a creature takes half as much damage and isn't knocked prone. The water then spreads out across the ground in all directions, extinguishing unprotected flames in its area and within 30 feet of it, and then it vanishes.",""
"Transmute Rock","XGE","169","5th","Action","Until dispelled","Transmutation","120 feet","V, S, M (clay and water)","Artificer, Druid, Druid, Wizard, Wizard","","You choose an area of stone or mud that you can see that fits within a 40-foot cube and is within range, and choose one of the following effects. Transmute Rock to Mud. Nonmagical rock of any sort in the area becomes an equal volume of thick, flowing mud that remains for the spell's duration.The ground in the spell's area becomes muddy enough that creatures can sink into it. Each foot that a creature moves through the mud costs 4 feet of movement, and any creature on the ground when you cast the spell must make a Strength saving throw. A creature must also make the saving throw when it moves into the area for the first time on a turn or ends its turn there. On a failed save, a creature sinks into the mud and is restrained, though it can use an action to end the restrained condition on itself by pulling itself free of the mud.If you cast the spell on a ceiling, the mud falls. Any creature under the mud when it falls must make a Dexterity saving throw. A creature takes 4d8 bludgeoning damage on a failed save, or half as much damage on a successful one. Transmute Mud to Rock. Nonmagical mud or quicksand in the area no more than 10 feet deep transforms into soft stone for the spell's duration. Any creature in the mud when it transforms must make a Dexterity saving throw. On a successful save, a creature is shunted safely to the surface in an unoccupied space. On a failed save, a creature becomes restrained by the rock. A restrained creature, or another creature within reach, can use an action to try to break the rock by succeeding on a DC 20 Strength check or by dealing damage to it. The rock has AC 15 and 25 hit points, and it is immune to poison and psychic damage.",""
"Transport via Plants","PHB'24","334","6th","Action","1 round","Conjuration","10 feet","V, S","Druid","","This spell creates a magical link between a Large or larger inanimate plant within range and another plant, at any distance, on the same plane of existence. You must have seen or touched the destination plant at least once before. For the duration, any creature can step into the target plant and exit from the destination plant by using 5 feet of movement.",""
